|4090|;|Literature|;|1|;|0|;|0|;|[["Pub Med ID", "Author", "Title", "Year"], ["<a href=http://www.ncbi.nlm.nih.gov/pubmed/16705037>16705037</a>", "Feng", "The Evf-2 noncoding RNA is transcribed from the Dlx-5/6 ultraconserved region and functions as a Dlx-2 transcriptional coactivator.", "2006"], ["<a href=http://www.ncbi.nlm.nih.gov/pubmed/15183307>15183307</a>", "Kohtz", "Developmental regulation of EVF-1, a novel non-coding RNA transcribed upstream of the mouse Dlx6 gene.", "2004"], ["<a href=http://www.ncbi.nlm.nih.gov/pubmed/18697905>18697905</a>", "Jeong", "Dlx genes pattern mammalian jaw primordium by regulating both lower jaw-specific and upper jaw-specific genetic programs.", "2008"], ["<a href=http://www.ncbi.nlm.nih.gov/pubmed/19620975>19620975</a>", "Bond", "Balanced gene regulation by an embryonic brain ncRNA is critical for adult hippocampal GABA circuitry.", "2009"], ["<a href=http://www.ncbi.nlm.nih.gov/pubmed/20137068>20137068</a>", "Mercer", "Long noncoding RNAs in neuronal-glial fate specification and oligodendrocyte lineage maturation.", "2010"], ["<a href=http://www.ncbi.nlm.nih.gov/pubmed/9415433>9415433</a>", "Liu", "Dlx genes encode DNA-binding proteins that are expressed in an overlapping and sequential pattern during basal ganglia differentiation.", "1997"], ["<a href=http://www.ncbi.nlm.nih.gov/pubmed/18562676>18562676</a>", "Dinger", "Long noncoding RNAs in mouse embryonic stem cell pluripotency and differentiation.", "2008"], ["<a href=http://www.ncbi.nlm.nih.gov/pubmed/17623775>17623775</a>", "Sone", "The mRNA-like noncoding RNA Gomafu constitutes a novel nuclear domain in a subset of neurons.", "2007"]]|
|4166|;|Literature|;|1|;|0|;|0|;|[["Pub Med ID", "Author", "Title", "Year"], ["<a href=http://www.ncbi.nlm.nih.gov/pubmed/11302516>11302516</a>", "Tycowski", "Non-coding snoRNA host genes in Drosophila: expression strategies for modification guide snoRNAs.", "2001"], ["<a href=http://www.ncbi.nlm.nih.gov/pubmed/15987805>15987805</a>", "Huang", "Genome-wide analyses of two families of snoRNA genes from Drosophila melanogaster, demonstrating the extensive utilization of introns for coding of snoRNAs.", "2005"]]|
|4167|;|Literature|;|1|;|0|;|0|;|[["Pub Med ID", "Author", "Title", "Year"], ["<a href=http://www.ncbi.nlm.nih.gov/pubmed/17957031>17957031</a>", "Chang", "A novel noncoding RNA rescues mutant SOD1-mediated cell death.", "2008"]]|
|4223|;|Literature|;|1|;|0|;|0|;|[["Pub Med ID", "Author", "Title", "Year"], ["<a href=http://www.ncbi.nlm.nih.gov/pubmed/20036157>20036157</a>", "Zhao", "Cytomegalovirus beta2.7 RNA transcript protects endothelial cells against apoptosis during ischemia/reperfusion injury.", "2010"], ["<a href=http://www.ncbi.nlm.nih.gov/pubmed/17540903>17540903</a>", "Reeves", "Complex I binding by a virally encoded RNA regulates mitochondria-induced cell death.", "2007"], ["<a href=http://www.ncbi.nlm.nih.gov/pubmed/2436392>2436392</a>", "Greenaway", "Nucleotide sequence of the most abundantly transcribed early gene of human cytomegalovirus strain AD169.", "1987"], ["<a href=http://www.ncbi.nlm.nih.gov/pubmed/11932411>11932411</a>", "Gawn", "Absence of IE1 p72 protein function during low-multiplicity infection by human cytomegalovirus results in a broad block to viral delayed-early gene expression.", "2002"], ["<a href=http://www.ncbi.nlm.nih.gov/pubmed/12917473>12917473</a>", "McSharry", "The most abundantly transcribed human cytomegalovirus gene (beta 2.7) is non-essential for growth in vitro.", "2003"]]|
|4222|;|Literature|;|1|;|0|;|0|;|[["Pub Med ID", "Author", "Title", "Year"], ["<a href=http://www.ncbi.nlm.nih.gov/pubmed/15169920>15169920</a>", "Nishant", "Characterization of a mouse recombination hot spot locus encoding a novel non-protein-coding RNA.", "2004"]]|
|4097|;|Literature|;|1|;|0|;|0|;|[["Pub Med ID", "Author", "Title", "Year"], ["<a href=http://www.ncbi.nlm.nih.gov/pubmed/17604720>17604720</a>", "Rinn", "Functional demarcation of active and silent chromatin domains in human HOX loci by noncoding RNAs.", "2007"], ["<a href=http://www.ncbi.nlm.nih.gov/pubmed/20393566>20393566</a>", "Gupta", "Long non-coding RNA HOTAIR reprograms chromatin state to promote cancer metastasis.", "2010"], ["<a href=http://www.ncbi.nlm.nih.gov/pubmed/19571010>19571010</a>", "Khalil", "Many human large intergenic noncoding RNAs associate with chromatin-modifying complexes and affect gene expression.", "2009"], ["<a href=http://www.ncbi.nlm.nih.gov/pubmed/20616235>20616235</a>", "Tsai", "Long Noncoding RNA as Modular Scaffold of Histone Modification Complexes.", "2010"], ["<a href=http://www.ncbi.nlm.nih.gov/pubmed/21496275>21496275</a>", "He", "The sequence, structure and evolutionary features of HOTAIR in mammals.", "2011"], ["<a href=http://www.ncbi.nlm.nih.gov/pubmed/21862635>21862635</a>", "Kogo", "Long Noncoding RNA HOTAIR Regulates Polycomb-Dependent Chromatin Modification and Is Associated with Poor Prognosis in Colorectal Cancers.", "2011"], ["<a href=http://www.ncbi.nlm.nih.gov/pubmed/21637793>21637793</a>", "Schorderet", "Structural and functional differences in the long non-coding RNA hotair in mouse and human.", "2011"], ["<a href=http://www.ncbi.nlm.nih.gov/pubmed/22369889>22369889</a>", "Tani", "Genome-wide determination of RNA stability reveals hundreds of short-lived noncoding transcripts in mammals.", "2012"]]|
|4163|;|Literature|;|1|;|0|;|0|;|[["Pub Med ID", "Author", "Title", "Year"], ["<a href=http://www.ncbi.nlm.nih.gov/pubmed/19160491>19160491</a>", "Candeias", "P53 mRNA controls p53 activity by managing Mdm2 functions.", "2008"]]|
|4220|;|Literature|;|1|;|0|;|0|;|[["Pub Med ID", "Author", "Title", "Year"], ["<a href=http://www.ncbi.nlm.nih.gov/pubmed/19147577>19147577</a>", "He", "A susceptibility locus for papillary thyroid carcinoma on chromosome 8q24.", "2009"]]|
|4272|;|Literature|;|1|;|0|;|0|;|[["Pub Med ID", "Author", "Title", "Year"], ["<a href=http://www.ncbi.nlm.nih.gov/pubmed/21127216>21127216</a>", "Heo", "Vernalization-mediated epigenetic silencing by a long intronic noncoding RNA.", "2011"]]|
|4089|;|Literature|;|1|;|0|;|0|;|[["Pub Med ID", "Author", "Title", "Year"], ["<a href=http://www.ncbi.nlm.nih.gov/pubmed/17237763>17237763</a>", "Martianov", "Repression of the human dihydrofolate reductase gene by a non-coding interfering transcript.", "2007"], ["<a href=http://www.ncbi.nlm.nih.gov/pubmed/19861437>19861437</a>", "Al-Shakfa", "DNA variants in region for noncoding interfering transcript of dihydrofolate reductase gene and outcome in childhood acute lymphoblastic leukemia.", "2009"], ["<a href=http://www.ncbi.nlm.nih.gov/pubmed/12461786>12461786</a>", "Blume", "The 5'-untranslated RNA of the human dhfr minor transcript alters transcription pre-initiation complex assembly at the major (core) promoter.", "2003"], ["<a href=http://www.ncbi.nlm.nih.gov/pubmed/2859520>2859520</a>", "Masters", "Discrete human dihydrofolate reductase gene transcripts present in polysomal RNA map with their 5' ends several hundred nucleotides upstream of the main mRNA start site.", "1985"], ["<a href=http://www.ncbi.nlm.nih.gov/pubmed/7566158>7566158</a>", "Akoulitchev", "Requirement for TFIIH kinase activity in transcription by RNA polymerase II.", "1995"]]|
|4111|;|Literature|;|1|;|0|;|0|;|[["Pub Med ID", "Author", "Title", "Year"], ["<a href=http://www.ncbi.nlm.nih.gov/pubmed/15855153>15855153</a>", "Sonkoly", "Identification and characterization of a novel, psoriasis susceptibility-related noncoding RNA gene, PRINS.", "2005"], ["<a href=http://www.ncbi.nlm.nih.gov/pubmed/20377629>20377629</a>", "Szegedi", "The anti-apoptotic protein G1P3 is overexpressed in psoriasis and regulated by the non-coding RNA, PRINS.", "2010"], ["<a href=http://www.ncbi.nlm.nih.gov/pubmed/21750967>21750967</a>", "Bari", "Comparison of stress-induced PRINS gene expression in normal human keratinocytes and HaCaT cells.", "2011"]]|
|4151|;|Literature|;|1|;|0|;|0|;|[["Pub Med ID", "Author", "Title", "Year"], ["<a href=http://www.ncbi.nlm.nih.gov/pubmed/20581224>20581224</a>", "Castelnuovo", "An Alu-like RNA promotes cell differentiation and reduces malignancy of human neuroblastoma cells.", "2010"], ["<a href=http://www.ncbi.nlm.nih.gov/pubmed/16000168>16000168</a>", "De Preter", "Positional and functional mapping of a neuroblastoma differentiation gene on chromosome 11.", "2005"], ["<a href=http://www.ncbi.nlm.nih.gov/pubmed/17274687>17274687</a>", "Pagano", "New small nuclear RNA gene-like transcriptional units as sources of regulatory transcripts.", "2007"]]|
|4150|;|Literature|;|1|;|0|;|0|;|[["Pub Med ID", "Author", "Title", "Year"], ["<a href=http://www.ncbi.nlm.nih.gov/pubmed/11337479>11337479</a>", "Charlier", "Human-ovine comparative sequencing of a 250-kb imprinted domain encompassing the callipyge (clpg) locus and identification of six imprinted transcripts: DLK1, DAT, GTL2, PEG11, antiPEG11, and MEG8.", "2001"], ["<a href=http://www.ncbi.nlm.nih.gov/pubmed/12796779>12796779</a>", "Seitz", "Imprinted microRNA genes transcribed antisense to a reciprocally imprinted retrotransposon-like gene.", "2003"], ["<a href=http://www.ncbi.nlm.nih.gov/pubmed/15854907>15854907</a>", "Davis", "RNAi-mediated allelic trans-interaction at the imprinted Rtl1/Peg11 locus.", "2005"], ["<a href=http://www.ncbi.nlm.nih.gov/pubmed/18532878>18532878</a>", "Edwards", "The evolution of the DLK1-DIO3 imprinted domain in mammals.", "2008"], ["<a href=http://www.ncbi.nlm.nih.gov/pubmed/19194500>19194500</a>", "Hagan", "At least ten genes define the imprinted Dlk1-Dio3 cluster on mouse chromosome 12qF1.", "2009"], ["<a href=http://www.ncbi.nlm.nih.gov/pubmed/20072617>20072617</a>", "Byrne", "The imprinted retrotransposon-like gene PEG11 (RTL1) is expressed as a full-length protein in skeletal muscle from Callipyge sheep.", "2010"], ["<a href=http://www.ncbi.nlm.nih.gov/pubmed/21172659>21172659</a>", "Zhao", "Genome-wide identification of polycomb-associated RNAs by RIP-seq.", "2010"]]|
|4152|;|Literature|;|1|;|0|;|0|;|[["Pub Med ID", "Author", "Title", "Year"], ["<a href=http://www.ncbi.nlm.nih.gov/pubmed/12851393>12851393</a>", "Haddad", "Role of antisense RNA in coordinating cardiac myosin heavy chain gene switching.", "2003"], ["<a href=http://www.ncbi.nlm.nih.gov/pubmed/17982008>17982008</a>", "Haddad", "Intergenic transcription and developmental regulation of cardiac myosin heavy chain genes.", "2008"], ["<a href=http://www.ncbi.nlm.nih.gov/pubmed/17030512>17030512</a>", "Pandorf", "Dynamics of myosin heavy chain gene regulation in slow skeletal muscle: role of natural antisense RNA.", "2006"], ["<a href=http://www.ncbi.nlm.nih.gov/pubmed/9632112>9632112</a>", "Luther", "Characterization of naturally occurring myosin heavy chain antisense mRNA in rat heart.", "1998"], ["<a href=http://www.ncbi.nlm.nih.gov/pubmed/16415074>16415074</a>", "Haddad", "Regulation of antisense RNA expression during cardiac MHC gene switching in response to pressure overload.", "2006"]]|
|4276|;|Literature|;|1|;|0|;|0|;|[["Pub Med ID", "Author", "Title", "Year"], ["<a href=http://www.ncbi.nlm.nih.gov/pubmed/20887892>20887892</a>", "\u00d8rom", "Long noncoding RNAs with enhancer-like function in human cells.", "2010"], ["<a href=http://www.ncbi.nlm.nih.gov/pubmed/21890647>21890647</a>", "Cabili", "Integrative annotation of human large intergenic noncoding RNAs reveals global properties and specific subclasses.", "2011"]]|
|4157|;|Literature|;|1|;|0|;|0|;|[["Pub Med ID", "Author", "Title", "Year"], ["<a href=http://www.ncbi.nlm.nih.gov/pubmed/12019237>12019237</a>", "Hardiman", "The bereft gene, a potential target of the neural selector gene cut, contributes to bristle morphogenesis.", "2002"], ["<a href=http://www.ncbi.nlm.nih.gov/pubmed/21179090>21179090</a>", "Graveley", "The developmental transcriptome of Drosophila melanogaster.", "2011"]]|
|4156|;|Literature|;|1|;|0|;|0|;|[["Pub Med ID", "Author", "Title", "Year"], ["<a href=http://www.ncbi.nlm.nih.gov/pubmed/19733073>19733073</a>", "Heinen", "Emergence of a new gene from an intergenic region.", "2009"]]|
|4158|;|Literature|;|1|;|0|;|0|;|[["Pub Med ID", "Author", "Title", "Year"], ["<a href=http://www.ncbi.nlm.nih.gov/pubmed/17643101>17643101</a>", "Franco-Zorrilla", "Target mimicry provides a new mechanism for regulation of microRNA activity.", "2007"], ["<a href=http://www.ncbi.nlm.nih.gov/pubmed/9106510>9106510</a>", "Liu", "Differential expression of TPS11, a phosphate starvation-induced gene in tomato.", "1997"], ["<a href=http://www.ncbi.nlm.nih.gov/pubmed/9207836>9207836</a>", "Burleigh", "A novel gene whose expression in Medicago truncatula roots is suppressed in response to colonization by vesicular-arbuscular mycorrhizal (VAM) fungi and to phosphate nutrition.", "1997"], ["<a href=http://www.ncbi.nlm.nih.gov/pubmed/9880366>9880366</a>", "Burleigh", "The down-regulation of Mt4-like genes by phosphate fertilization occurs systemically and involves phosphate translocation to the shoots.", "1999"], ["<a href=http://www.ncbi.nlm.nih.gov/pubmed/11123795>11123795</a>", "Mart\u00edn", "Influence of cytokinins on the expression of phosphate starvation responsive genes in Arabidopsis.", "2000"], ["<a href=http://www.ncbi.nlm.nih.gov/pubmed/16460506>16460506</a>", "Shin", "Loss of At4 function impacts phosphate distribution between the roots and the shoots during phosphate starvation.", "2006"]]|
|4277|;|Literature|;|1|;|0|;|0|;|[["Pub Med ID", "Author", "Title", "Year"], ["<a href=http://www.ncbi.nlm.nih.gov/pubmed/20887892>20887892</a>", "\u00d8rom", "Long noncoding RNAs with enhancer-like function in human cells.", "2010"]]|
|4278|;|Literature|;|1|;|0|;|0|;|[["Pub Med ID", "Author", "Title", "Year"], ["<a href=http://www.ncbi.nlm.nih.gov/pubmed/20887892>20887892</a>", "\u00d8rom", "Long noncoding RNAs with enhancer-like function in human cells.", "2010"]]|
|4238|;|Literature|;|1|;|0|;|0|;|[["Pub Med ID", "Author", "Title", "Year"], ["<a href=http://www.ncbi.nlm.nih.gov/pubmed/18997003>18997003</a>", "Ben Amor", "Novel long non-protein coding RNAs involved in Arabidopsis differentiation and stress responses.", "2009"], ["<a href=http://www.ncbi.nlm.nih.gov/pubmed/16500993>16500993</a>", "Hirsch", "Characterization of 43 non-protein-coding mRNA genes in Arabidopsis, including the MIR162a-derived transcripts.", "2006"]]|
|4239|;|Literature|;|1|;|0|;|0|;|[["Pub Med ID", "Author", "Title", "Year"], ["<a href=http://www.ncbi.nlm.nih.gov/pubmed/18997003>18997003</a>", "Ben Amor", "Novel long non-protein coding RNAs involved in Arabidopsis differentiation and stress responses.", "2009"], ["<a href=http://www.ncbi.nlm.nih.gov/pubmed/16500993>16500993</a>", "Hirsch", "Characterization of 43 non-protein-coding mRNA genes in Arabidopsis, including the MIR162a-derived transcripts.", "2006"]]|
|4279|;|Literature|;|1|;|0|;|0|;|[["Pub Med ID", "Author", "Title", "Year"], ["<a href=http://www.ncbi.nlm.nih.gov/pubmed/22000014>22000014</a>", "Cesana", "A long noncoding RNA controls muscle differentiation by functioning as a competing endogenous RNA.", "2011"]]|
|4234|;|Literature|;|1|;|0|;|0|;|[["Pub Med ID", "Author", "Title", "Year"], ["<a href=http://www.ncbi.nlm.nih.gov/pubmed/12837039>12837039</a>", "Wang", "Characterization of adapt33, a stress-inducible riboregulator.", "2003"], ["<a href=http://www.ncbi.nlm.nih.gov/pubmed/8806733>8806733</a>", "Wang", "adapt33, a novel oxidant-inducible RNA from hamster HA-1 cells.", "1996"], ["<a href=http://www.ncbi.nlm.nih.gov/pubmed/21874018>21874018</a>", "Guttman", "lincRNAs act in the circuitry controlling pluripotency and differentiation.", "2011"], ["<a href=http://www.ncbi.nlm.nih.gov/pubmed/22406755>22406755</a>", "Clark", "Genome-wide analysis of long noncoding RNA stability.", "2012"]]|
|4236|;|Literature|;|1|;|0|;|0|;|[["Pub Med ID", "Author", "Title", "Year"], ["<a href=http://www.ncbi.nlm.nih.gov/pubmed/19805129>19805129</a>", "Bumgarner", "Toggle involving cis-interfering noncoding RNAs controls variegated gene expression in yeast.", "2009"]]|
|4237|;|Literature|;|1|;|0|;|0|;|[["Pub Med ID", "Author", "Title", "Year"], ["<a href=http://www.ncbi.nlm.nih.gov/pubmed/20137068>20137068</a>", "Mercer", "Long noncoding RNAs in neuronal-glial fate specification and oligodendrocyte lineage maturation.", "2010"], ["<a href=http://www.ncbi.nlm.nih.gov/pubmed/18562676>18562676</a>", "Dinger", "Long noncoding RNAs in mouse embryonic stem cell pluripotency and differentiation.", "2008"], ["<a href=http://www.ncbi.nlm.nih.gov/pubmed/8812481>8812481</a>", "McGuinness", "Sequence, organization, and transcription of the Dlx-1 and Dlx-2 locus.", "1996"], ["<a href=http://www.ncbi.nlm.nih.gov/pubmed/9415433>9415433</a>", "Liu", "Dlx genes encode DNA-binding proteins that are expressed in an overlapping and sequential pattern during basal ganglia differentiation.", "1997"]]|
|4232|;|Literature|;|1|;|0|;|0|;|[["Pub Med ID", "Author", "Title", "Year"], ["<a href=http://www.ncbi.nlm.nih.gov/pubmed/16915236>16915236</a>", "Pollard", "An RNA gene expressed during cortical development evolved rapidly in humans.", "2006"], ["<a href=http://www.ncbi.nlm.nih.gov/pubmed/18511501>18511501</a>", "Beniaminov", "Distinctive structures between chimpanzee and human in a brain noncoding RNA.", "2008"], ["<a href=http://www.ncbi.nlm.nih.gov/pubmed/20179156>20179156</a>", "Johnson", "The Human Accelerated Region 1 noncoding RNA is repressed by REST in Huntington's disease.", "2010"]]|
|4201|;|Literature|;|1|;|0|;|0|;|[["Pub Med ID", "Author", "Title", "Year"], ["<a href=http://www.ncbi.nlm.nih.gov/pubmed/10814723>10814723</a>", "Millar", "Disruption of two novel genes by a translocation co-segregating with schizophrenia.", "2000"], ["<a href=http://www.ncbi.nlm.nih.gov/pubmed/12573262>12573262</a>", "Taylor", "Evolutionary constraints on the Disrupted in Schizophrenia locus.", "2003"]]|
|4200|;|Literature|;|1|;|0|;|0|;|[["Pub Med ID", "Author", "Title", "Year"], ["<a href=http://www.ncbi.nlm.nih.gov/pubmed/15300240>15300240</a>", "Allen", "The SINE-encoded mouse B2 RNA represses mRNA transcription in response to heat shock.", "2004"], ["<a href=http://www.ncbi.nlm.nih.gov/pubmed/15300239>15300239</a>", "Espinoza", "B2 RNA binds directly to RNA polymerase II to repress transcript synthesis.", "2004"], ["<a href=http://www.ncbi.nlm.nih.gov/pubmed/17307818>17307818</a>", "Espinoza", "Characterization of the structure, function, and mechanism of B2 RNA, an ncRNA repressor of RNA polymerase II transcription.", "2007"], ["<a href=http://www.ncbi.nlm.nih.gov/pubmed/370792>370792</a>", "Kramerov", "Long double-stranded sequences (dsRNA-B) of nuclear pre-mRNA consist of a few highly abundant classes of sequences: evidence from DNA cloning experiments.", "1979"], ["<a href=http://www.ncbi.nlm.nih.gov/pubmed/6296779>6296779</a>", "Krayev", "Ubiquitous transposon-like repeats B1 and B2 of the mouse genome: B2 sequencing.", "1982"], ["<a href=http://www.ncbi.nlm.nih.gov/pubmed/2426659>2426659</a>", "Fornace", "Induction of B2 RNA polymerase III transcription by heat shock: enrichment for heat shock induced sequences in rodent cells by hybridization subtraction.", "1986"], ["<a href=http://www.ncbi.nlm.nih.gov/pubmed/6130513>6130513</a>", "Kramerov", "The sequences homologous to major interspersed repeats B1 and B2 of mouse genome are present in mRNA and small cytoplasmic poly(A) + RNA.", "1982"], ["<a href=http://www.ncbi.nlm.nih.gov/pubmed/3839306>3839306</a>", "Lawrence", "Analysis of repetitive sequence elements containing tRNA-like sequences.", "1985"], ["<a href=http://www.ncbi.nlm.nih.gov/pubmed/2581137>2581137</a>", "Singh", "Expression of enhanced levels of small RNA polymerase III transcripts encoded by the B2 repeats in simian virus 40-transformed mouse cells.", "1985"], ["<a href=http://www.ncbi.nlm.nih.gov/pubmed/3851163>3851163</a>", "Daniels", "Repeat sequence families derived from mammalian tRNA genes.", "1985"], ["<a href=http://www.ncbi.nlm.nih.gov/pubmed/19307572>19307572</a>", "Yakovchuk", "B2 RNA and Alu RNA repress transcription by disrupting contacts between RNA polymerase II and promoter DNA within assembled complexes.", "2009"], ["<a href=http://www.ncbi.nlm.nih.gov/pubmed/2461884>2461884</a>", "Bachvarova", "Small B2 RNAs in mouse oocytes, embryos, and somatic tissues.", "1988"]]|
|4144|;|Literature|;|1|;|0|;|0|;|[["Pub Med ID", "Author", "Title", "Year"], ["<a href=http://www.ncbi.nlm.nih.gov/pubmed/20211147>20211147</a>", "Hashimoto", "A liver X receptor (LXR)-beta alternative splicing variant (LXRBSV) is preferentially expressed in the pituitary.", "2010"], ["<a href=http://www.ncbi.nlm.nih.gov/pubmed/19878653>19878653</a>", "Hashimoto", "A liver X receptor (LXR)-beta alternative splicing variant (LXRBSV) acts as an RNA co-activator of LXR-beta.", "2009"]]|
|4145|;|Literature|;|1|;|0|;|0|;|[["Pub Med ID", "Author", "Title", "Year"], ["<a href=http://www.ncbi.nlm.nih.gov/pubmed/20444925>20444925</a>", "Chillambhi", "Deletion of the Noncoding GNAS Antisense Transcript Causes Pseudohypoparathyroidism Type Ib and Biparental Defects of GNAS Methylation in cis.", "2010"], ["<a href=http://www.ncbi.nlm.nih.gov/pubmed/11056047>11056047</a>", "Li", "Tissue-specific expression of antisense and sense transcripts at the imprinted Gnas locus.", "2000"], ["<a href=http://www.ncbi.nlm.nih.gov/pubmed/11889554>11889554</a>", "Williamson", "Alternative non-coding splice variants of Nespas, an imprinted gene antisense to Nesp in the Gnas imprinting cluster.", "2002"], ["<a href=http://www.ncbi.nlm.nih.gov/pubmed/\t10716699>\t10716699</a>", "Wroe", "An imprinted transcript, antisense to Nesp, adds complexity to the cluster of imprinted genes at the mouse Gnas locus.", "2000"], ["<a href=http://www.ncbi.nlm.nih.gov/pubmed/16462745>16462745</a>", "Williamson", "Identification of an imprinting control region affecting the expression of all transcripts in the Gnas cluster.", "2006"], ["<a href=http://www.ncbi.nlm.nih.gov/pubmed/21172659>21172659</a>", "Zhao", "Genome-wide identification of polycomb-associated RNAs by RIP-seq.", "2010"]]|
|4142|;|Literature|;|1|;|0|;|0|;|[["Pub Med ID", "Author", "Title", "Year"], ["<a href=http://www.ncbi.nlm.nih.gov/pubmed/9334315>9334315</a>", "Ashe", "Intergenic transcription and transinduction of the human beta-globin locus.", "1997"], ["<a href=http://www.ncbi.nlm.nih.gov/pubmed/10882078>10882078</a>", "Gribnau", "Intergenic transcription and developmental remodeling of chromatin subdomains in the human beta-globin locus.", "2000"], ["<a href=http://www.ncbi.nlm.nih.gov/pubmed/16227618>16227618</a>", "Haussecker", "Dicer-dependent turnover of intergenic transcripts from the human beta-globin gene cluster.", "2005"], ["<a href=http://www.ncbi.nlm.nih.gov/pubmed/17283048>17283048</a>", "Kim", "Beta-globin intergenic transcription and histone acetylation dependent on an enhancer.", "2007"], ["<a href=http://www.ncbi.nlm.nih.gov/pubmed/17704132>17704132</a>", "Zhu", "A facilitated tracking and transcription mechanism of long-range enhancer function.", "2007"]]|
