|4101|;|Literature|;|1|;|0|;|0|;|[["Pub Med ID", "Author", "Title", "Year"], ["<a href=http://www.ncbi.nlm.nih.gov/pubmed/15340049>15340049</a>", "Thakur", "An antisense RNA regulates the bidirectional silencing property of the Kcnq1 imprinting control region.", "2004"], ["<a href=http://www.ncbi.nlm.nih.gov/pubmed/18299392>18299392</a>", "Mohammad", "Kcnq1ot1/Lit1 noncoding RNA mediates transcriptional silencing by targeting to the perinucleolar region.", "2008"], ["<a href=http://www.ncbi.nlm.nih.gov/pubmed/18951091>18951091</a>", "Pandey", "Kcnq1ot1 antisense noncoding RNA mediates lineage-specific transcriptional silencing through chromatin-level regulation.", "2008"], ["<a href=http://www.ncbi.nlm.nih.gov/pubmed/18848501>18848501</a>", "Terranova", "Polycomb group proteins Ezh2 and Rnf2 direct genomic contraction and imprinted repression in early mouse embryos.", "2008"], ["<a href=http://www.ncbi.nlm.nih.gov/pubmed/19144718>19144718</a>", "Redrup", "The long noncoding RNA Kcnq1ot1 organises a lineage-specific nuclear domain for epigenetic gene silencing.", "2009"], ["<a href=http://www.ncbi.nlm.nih.gov/pubmed/17917697>17917697</a>", "Murakami", "Suggestive evidence for chromosomal localization of non-coding RNA from imprinted LIT1.", "2007"], ["<a href=http://www.ncbi.nlm.nih.gov/pubmed/20573698>20573698</a>", "Mohammad", "Kcnq1ot1 noncoding RNA mediates transcriptional gene silencing by interacting with Dnmt1.", "2010"], ["<a href=http://www.ncbi.nlm.nih.gov/pubmed/10393948>10393948</a>", "Smilinich", "A maternally methylated CpG island in KvLQT1 is associated with an antisense paternal transcript and loss of imprinting in Beckwith-Wiedemann syndrome.", "1999"], ["<a href=http://www.ncbi.nlm.nih.gov/pubmed/15516932>15516932</a>", "Umlauf", "Imprinting along the Kcnq1 domain on mouse chromosome 7 involves repressive histone methylation and recruitment of Polycomb group complexes.", "2004"], ["<a href=http://www.ncbi.nlm.nih.gov/pubmed/17242189>17242189</a>", "Fitzpatrick", "Allele-specific binding of CTCF to the multipartite imprinting control region KvDMR1.", "2007"], ["<a href=http://www.ncbi.nlm.nih.gov/pubmed/10369866>10369866</a>", "Mitsuya", "LIT1, an imprinted antisense RNA in the human KvLQT1 locus identified by screening for differentially expressed transcripts using monochromosomal hybrids.", "1999"], ["<a href=http://www.ncbi.nlm.nih.gov/pubmed/11813134>11813134</a>", "DeBaun", "Epigenetic alterations of H19 and LIT1 distinguish patients with Beckwith-Wiedemann syndrome with cancer and birth defects.", "2002"], ["<a href=http://www.ncbi.nlm.nih.gov/pubmed/16702402>16702402</a>", "Mancini-Dinardo", "Elongation of the Kcnq1ot1 transcript is required for genomic imprinting of neighboring genes.", "2006"], ["<a href=http://www.ncbi.nlm.nih.gov/pubmed/16575194>16575194</a>", "Higashimoto", "Imprinting disruption of the CDKN1C/KCNQ1OT1 domain: the molecular mechanisms causing Beckwith-Wiedemann syndrome and cancer.", "2006"], ["<a href=http://www.ncbi.nlm.nih.gov/pubmed/16965397>16965397</a>", "Nakano", "Expression profile of LIT1/KCNQ1OT1 and epigenetic status at the KvDMR1 in colorectal cancers.", "2006"], ["<a href=http://www.ncbi.nlm.nih.gov/pubmed/10958646>10958646</a>", "Horike", "Targeted disruption of the human LIT1 locus defines a putative imprinting control element playing an essential role in Beckwith-Wiedemann syndrome.", "2000"], ["<a href=http://www.ncbi.nlm.nih.gov/pubmed/21345374>21345374</a>", "Kanduri", "Kcnq1ot1: A chromatin regulatory RNA.", "2011"], ["<a href=http://www.ncbi.nlm.nih.gov/pubmed/15590939>15590939</a>", "Paulsen", "Evolution of the Beckwith-Wiedemann syndrome region in vertebrates.", "2005"], ["<a href=http://www.ncbi.nlm.nih.gov/pubmed/15459184>15459184</a>", "Pandey", "NF-Y regulates the antisense promoter, bidirectional silencing, and differential epigenetic marks of the Kcnq1 imprinting control region.", "2004"], ["<a href=http://www.ncbi.nlm.nih.gov/pubmed/21172659>21172659</a>", "Zhao", "Genome-wide identification of polycomb-associated RNAs by RIP-seq.", "2010"], ["<a href=http://www.ncbi.nlm.nih.gov/pubmed/21576366>21576366</a>", "Jones", "An extended domain of kcnq1ot1 silencing revealed by an imprinted fluorescent reporter.", "2011"], ["<a href=http://www.ncbi.nlm.nih.gov/pubmed/22406755>22406755</a>", "Clark", "Genome-wide analysis of long noncoding RNA stability.", "2012"]]|
|4106|;|Literature|;|1|;|0|;|0|;|[["Pub Med ID", "Author", "Title", "Year"], ["<a href=http://www.ncbi.nlm.nih.gov/pubmed/12084570>12084570</a>", "Madamanchi", "A noncoding RNA regulates human protease-activated receptor-1 gene during embryogenesis.", "2002"]]|
|4107|;|Literature|;|1|;|0|;|0|;|[["Pub Med ID", "Author", "Title", "Year"], ["<a href=http://www.ncbi.nlm.nih.gov/pubmed/18538132>18538132</a>", "Tochitani", "Nkx2.2 antisense RNA overexpression enhanced oligodendrocytic differentiation.", "2008"]]|
|4104|;|Literature|;|1|;|0|;|0|;|[["Pub Med ID", "Author", "Title", "Year"], ["<a href=http://www.ncbi.nlm.nih.gov/pubmed/10759892>10759892</a>", "Miyoshi", "Identification of an imprinted gene, Meg3/Gtl2 and its human homologue MEG3, first mapped on mouse distal chromosome 12 and human chromosome 14q.", "2000"], ["<a href=http://www.ncbi.nlm.nih.gov/pubmed/16342203>16342203</a>", "Manji", "Molecular characterization and expression of maternally expressed gene 3 (Meg3/Gtl2) RNA in the mouse inner ear.", "2006"], ["<a href=http://www.ncbi.nlm.nih.gov/pubmed/9626496>9626496</a>", "Schuster-Gossler", "The mouse Gtl2 gene is differentially expressed during embryonic development, encodes multiple alternatively spliced transcripts, and may act as an RNA.", "1998"], ["<a href=http://www.ncbi.nlm.nih.gov/pubmed/14602737>14602737</a>", "Zhang", "A pituitary-derived MEG3 isoform functions as a growth suppressor in tumor cells.", "2003"], ["<a href=http://www.ncbi.nlm.nih.gov/pubmed/20392836>20392836</a>", "Gordon", "Increased expression of angiogenic genes in the brains of mouse meg3-null embryos.", "2010"], ["<a href=http://www.ncbi.nlm.nih.gov/pubmed/20179190>20179190</a>", "Zhang", "Maternally expressed gene 3, an imprinted noncoding RNA gene, is associated with meningioma pathogenesis and progression.", "2010"], ["<a href=http://www.ncbi.nlm.nih.gov/pubmed/17569660>17569660</a>", "Zhou", "Activation of p53 by MEG3 non-coding RNA.", "2007"], ["<a href=http://www.ncbi.nlm.nih.gov/pubmed/15226823>15226823</a>", "Blackshaw", "Genomic analysis of mouse retinal development.", "2004"], ["<a href=http://www.ncbi.nlm.nih.gov/pubmed/19194500>19194500</a>", "Hagan", "At least ten genes define the imprinted Dlk1-Dio3 cluster on mouse chromosome 12qF1.", "2009"], ["<a href=http://www.ncbi.nlm.nih.gov/pubmed/20418860>20418860</a>", "Stadtfeld", "Aberrant silencing of imprinted genes on chromosome 12qF1 in mouse induced pluripotent stem cells.", "2010"], ["<a href=http://www.ncbi.nlm.nih.gov/pubmed/19264764>19264764</a>", "Takahashi", "Deletion of Gtl2, imprinted non-coding RNA, with its differentially methylated region induces lethal parent-origin-dependent defects in mice.", "2009"], ["<a href=http://www.ncbi.nlm.nih.gov/pubmed/11683710>11683710</a>", "Bidwell", "Differential expression of the GTL2 gene within the callipyge region of ovine chromosome 18.", "2001"], ["<a href=http://www.ncbi.nlm.nih.gov/pubmed/20032057>20032057</a>", "Zhang", "Maternally expressed gene 3 (MEG3) noncoding ribonucleic acid: isoform structure, expression, and functions.", "2010"], ["<a href=http://www.ncbi.nlm.nih.gov/pubmed/20137068>20137068</a>", "Mercer", "Long noncoding RNAs in neuronal-glial fate specification and oligodendrocyte lineage maturation.", "2010"], ["<a href=http://www.ncbi.nlm.nih.gov/pubmed/20404130>20404130</a>", "Mondal", "Characterization of the RNA content of chromatin.", "2010"], ["<a href=http://www.ncbi.nlm.nih.gov/pubmed/21128942>21128942</a>", "Michelhaugh", "Mining Affymetrix microarray data for long noncoding RNAs: altered expression in the nucleus accumbens of heroin abusers.", "2010"], ["<a href=http://www.ncbi.nlm.nih.gov/pubmed/16356785>16356785</a>", "McLaughlin", "Expression pattern of the maternally imprinted gene Gtl2 in the forebrain during embryonic development and adulthood.", "2006"], ["<a href=http://www.ncbi.nlm.nih.gov/pubmed/16793321>16793321</a>", "Zhao", "Cyclic AMP stimulates MEG3 gene expression in cells through a cAMP-response element (CRE) in the MEG3 proximal promoter region.", "2006"], ["<a href=http://www.ncbi.nlm.nih.gov/pubmed/21172659>21172659</a>", "Zhao", "Genome-wide identification of polycomb-associated RNAs by RIP-seq.", "2010"], ["<a href=http://www.ncbi.nlm.nih.gov/pubmed/22202438>22202438</a>", "Johnson", "Long non-coding RNAs in Huntington's disease neurodegeneration.", "2012"]]|
|4105|;|Literature|;|1|;|0|;|0|;|[["Pub Med ID", "Author", "Title", "Year"], ["<a href=http://www.ncbi.nlm.nih.gov/pubmed/20137068>20137068</a>", "Mercer", "Long noncoding RNAs in neuronal-glial fate specification and oligodendrocyte lineage maturation.", "2010"], ["<a href=http://www.ncbi.nlm.nih.gov/pubmed/17270048>17270048</a>", "Hutchinson", "A screen for nuclear transcripts identifies two linked noncoding RNAs associated with SC35 splicing domains.", "2007"], ["<a href=http://www.ncbi.nlm.nih.gov/pubmed/19716791>19716791</a>", "Chen", "Altered nuclear retention of mRNAs containing inverted repeats in human embryonic stem cells: functional role of a nuclear noncoding RNA.", "2009"], ["<a href=http://www.ncbi.nlm.nih.gov/pubmed/19217333>19217333</a>", "Clemson", "An architectural role for a nuclear noncoding RNA: NEAT1 RNA is essential for the structure of paraspeckles.", "2009"], ["<a href=http://www.ncbi.nlm.nih.gov/pubmed/19188602>19188602</a>", "Sasaki", "MENepsilon/beta noncoding RNAs are essential for structural integrity of nuclear paraspeckles.", "2009"], ["<a href=http://www.ncbi.nlm.nih.gov/pubmed/19106332>19106332</a>", "Sunwoo", "MEN epsilon/beta nuclear-retained non-coding RNAs are up-regulated upon muscle differentiation and are essential components of paraspeckles.", "2009"], ["<a href=http://www.ncbi.nlm.nih.gov/pubmed/16760401>16760401</a>", "Saha", "Identification and characterization of a virus-inducible non-coding RNA in mouse brain.", "2006"], ["<a href=http://www.ncbi.nlm.nih.gov/pubmed/9253601>9253601</a>", "Guru", "A transcript map for the 2.8-Mb region containing the multiple endocrine neoplasia type 1 locus.", "1997"], ["<a href=http://www.ncbi.nlm.nih.gov/pubmed/20211624>20211624</a>", "Murthy", "Identification of protein interaction regions of VINC/NEAT1/Men epsilon RNA.", "2010"], ["<a href=http://www.ncbi.nlm.nih.gov/pubmed/9858482>9858482</a>", "Peyman", "Repression of major histocompatibility complex genes by a human trophoblast ribonucleic acid.", "1999"], ["<a href=http://www.ncbi.nlm.nih.gov/pubmed/21128942>21128942</a>", "Michelhaugh", "Mining Affymetrix microarray data for long noncoding RNAs: altered expression in the nucleus accumbens of heroin abusers.", "2010"], ["<a href=http://www.ncbi.nlm.nih.gov/pubmed/21170033>21170033</a>", "Mao", "Direct visualization of the co-transcriptional assembly of a nuclear body by noncoding RNAs.", "2011"], ["<a href=http://www.ncbi.nlm.nih.gov/pubmed/20881053>20881053</a>", "Souquere", "Highly ordered spatial organization of the structural long noncoding NEAT1 RNAs within paraspeckle nuclear bodies.", "2010"], ["<a href=http://www.ncbi.nlm.nih.gov/pubmed/21444682>21444682</a>", "Nakagawa", "Paraspeckles are subpopulation-specific nuclear bodies that are not essential in mice.", "2011"], ["<a href=http://www.ncbi.nlm.nih.gov/pubmed/21240286>21240286</a>", "Shevtsov", "Nucleation of nuclear bodies by RNA.", "2011"], ["<a href=http://www.ncbi.nlm.nih.gov/pubmed/21874018>21874018</a>", "Guttman", "lincRNAs act in the circuitry controlling pluripotency and differentiation.", "2011"], ["<a href=http://www.ncbi.nlm.nih.gov/pubmed/22406755>22406755</a>", "Clark", "Genome-wide analysis of long noncoding RNA stability.", "2012"], ["<a href=http://www.ncbi.nlm.nih.gov/pubmed/19561200>19561200</a>", "Friedel", "Conserved principles of mammalian transcriptional regulation revealed by RNA half-life.", "2009"], ["<a href=http://www.ncbi.nlm.nih.gov/pubmed/22202438>22202438</a>", "Johnson", "Long non-coding RNAs in Huntington's disease neurodegeneration.", "2012"]]|
|4224|;|Literature|;|1|;|0|;|0|;|[["Pub Med ID", "Author", "Title", "Year"], ["<a href=http://www.ncbi.nlm.nih.gov/pubmed/20399962>20399962</a>", "Iwakiri", "Role of EBERs in the pathogenesis of EBV infection.", "2010"], ["<a href=http://www.ncbi.nlm.nih.gov/pubmed/19720839>19720839</a>", "Iwakiri", "Epstein-Barr virus (EBV)-encoded small RNA is released from EBV-infected cells and activates signaling from Toll-like receptor 3.", "2009"], ["<a href=http://www.ncbi.nlm.nih.gov/pubmed/19640998>19640998</a>", "Houmani", "Growth-promoting properties of Epstein-Barr virus EBER-1 RNA correlate with ribosomal protein L22 binding.", "2009"], ["<a href=http://www.ncbi.nlm.nih.gov/pubmed/18957101>18957101</a>", "Eilebrecht", "EBER2 RNA-induced transcriptome changes identify cellular processes likely targeted during Epstein Barr Virus infection.", "2008"], ["<a href=http://www.ncbi.nlm.nih.gov/pubmed/1673026>1673026</a>", "Clarke", "Binding of Epstein-Barr virus small RNA EBER-1 to the double-stranded RNA-activated protein kinase DAI.", "1991"], ["<a href=http://www.ncbi.nlm.nih.gov/pubmed/7901835>7901835</a>", "Sharp", "Comparative analysis of the regulation of the interferon-inducible protein kinase PKR by Epstein-Barr virus RNAs EBER-1 and EBER-2 and adenovirus VAI RNA.", "1993"], ["<a href=http://www.ncbi.nlm.nih.gov/pubmed/16160154>16160154</a>", "Nanbo", "Epstein-Barr virus-encoded poly(A)- RNA confers resistance to apoptosis mediated through Fas by blocking the PKR pathway in human epithelial intestine 407 cells.", "2005"], ["<a href=http://www.ncbi.nlm.nih.gov/pubmed/16580685>16580685</a>", "McKenna", "Uncoupling of RNA binding and PKR kinase activation by viral inhibitor RNAs.", "2006"], ["<a href=http://www.ncbi.nlm.nih.gov/pubmed/6281455>6281455</a>", "Arrand", "Characterization of the major Epstein-Barr virus-specific RNA in Burkitt lymphoma-derived cells.", "1982"], ["<a href=http://www.ncbi.nlm.nih.gov/pubmed/9279391>9279391</a>", "Rosa", "Striking similarities are exhibited by two small Epstein-Barr virus-encoded ribonucleic acids and the adenovirus-associated ribonucleic acids VAI and VAII.", "1981"], ["<a href=http://www.ncbi.nlm.nih.gov/pubmed/14612496>14612496</a>", "Iwakiri", "Autocrine growth of Epstein-Barr virus-positive gastric carcinoma cells mediated by an Epstein-Barr virus-encoded small RNA.", "2003"], ["<a href=http://www.ncbi.nlm.nih.gov/pubmed/15608666>15608666</a>", "Iwakiri", "Epstein-Barr virus-encoded small RNA induces insulin-like growth factor 1 and supports growth of nasopharyngeal carcinoma-derived cell lines.", "2005"], ["<a href=http://www.ncbi.nlm.nih.gov/pubmed/11068051>11068051</a>", "Yamamoto", "Malignant transformation of B lymphoma cell line BJAB by Epstein-Barr virus-encoded small RNAs.", "2000"], ["<a href=http://www.ncbi.nlm.nih.gov/pubmed/11024153>11024153</a>", "Ruf", "Epstein-Barr virus small RNAs potentiate tumorigenicity of Burkitt lymphoma cells independently of an effect on apoptosis.", "2000"], ["<a href=http://www.ncbi.nlm.nih.gov/pubmed/17686859>17686859</a>", "Wu", "Epstein-Barr virus (EBV)-encoded RNA 2 (EBER2) but not EBER1 plays a critical role in EBV-induced B-cell growth transformation.", "2007"], ["<a href=http://www.ncbi.nlm.nih.gov/pubmed/2828685>2828685</a>", "Glickman", "Structural analyses of EBER1 and EBER2 ribonucleoprotein particles present in Epstein-Barr virus-infected cells.", "1988"], ["<a href=http://www.ncbi.nlm.nih.gov/pubmed/6262773>6262773</a>", "Lerner", "Two small RNAs encoded by Epstein-Barr virus and complexed with protein are precipitated by antibodies from patients with systemic lupus erythematosus.", "1981"], ["<a href=http://www.ncbi.nlm.nih.gov/pubmed/16556938>16556938</a>", "Fok", "Multiple domains of EBER 1, an Epstein-Barr virus noncoding RNA, recruit human ribosomal protein L22.", "2006"], ["<a href=http://www.ncbi.nlm.nih.gov/pubmed/7494316>7494316</a>", "Dobbelstein", "In vitro selection of RNA ligands for the ribosomal L22 protein associated with Epstein-Barr virus-expressed RNA by using randomized and cDNA-derived RNA libraries.", "1995"], ["<a href=http://www.ncbi.nlm.nih.gov/pubmed/2536122>2536122</a>", "Arrand", "Two families of sequences in the small RNA-encoding region of Epstein-Barr virus (EBV) correlate with EBV types A and B.", "1989"], ["<a href=http://www.ncbi.nlm.nih.gov/pubmed/11867523>11867523</a>", "Nanbo", "Epstein-Barr virus RNA confers resistance to interferon-alpha-induced apoptosis in Burkitt's lymphoma.", "2002"]]|
|4258|;|Literature|;|1|;|0|;|0|;|[["Pub Med ID", "Author", "Title", "Year"], ["<a href=http://www.ncbi.nlm.nih.gov/pubmed/21874018>21874018</a>", "Guttman", "lincRNAs act in the circuitry controlling pluripotency and differentiation.", "2011"], ["<a href=http://www.ncbi.nlm.nih.gov/pubmed/20436462>20436462</a>", "Guttman", "Ab initio reconstruction of cell type-specific transcriptomes in mouse reveals the conserved multi-exonic structure of lincRNAs.", "2010"]]|
|4259|;|Literature|;|1|;|0|;|0|;|[["Pub Med ID", "Author", "Title", "Year"], ["<a href=http://www.ncbi.nlm.nih.gov/pubmed/21874018>21874018</a>", "Guttman", "lincRNAs act in the circuitry controlling pluripotency and differentiation.", "2011"], ["<a href=http://www.ncbi.nlm.nih.gov/pubmed/20436462>20436462</a>", "Guttman", "Ab initio reconstruction of cell type-specific transcriptomes in mouse reveals the conserved multi-exonic structure of lincRNAs.", "2010"], ["<a href=http://www.ncbi.nlm.nih.gov/pubmed/22406755>22406755</a>", "Clark", "Genome-wide analysis of long noncoding RNA stability.", "2012"]]|
|4178|;|Literature|;|1|;|0|;|0|;|[["Pub Med ID", "Author", "Title", "Year"], ["<a href=http://www.ncbi.nlm.nih.gov/pubmed/15703187>15703187</a>", "Alfano", "Natural antisense transcripts associated with genes involved in eye development.", "2005"]]|
|4177|;|Literature|;|1|;|0|;|0|;|[["Pub Med ID", "Author", "Title", "Year"], ["<a href=http://www.ncbi.nlm.nih.gov/pubmed/17445766>17445766</a>", "Sasaki", "Coordinated expression of ncRNAs and HOX mRNAs in the human HOXA locus.", "2007"], ["<a href=http://www.ncbi.nlm.nih.gov/pubmed/17185360>17185360</a>", "Sessa", "Noncoding RNA synthesis and loss of Polycomb group repression accompanies the colinear activation of the human HOXA cluster.", "2007"]]|
|4176|;|Literature|;|1|;|0|;|0|;|[["Pub Med ID", "Author", "Title", "Year"], ["<a href=http://www.ncbi.nlm.nih.gov/pubmed/17445766>17445766</a>", "Sasaki", "Coordinated expression of ncRNAs and HOX mRNAs in the human HOXA locus.", "2007"], ["<a href=http://www.ncbi.nlm.nih.gov/pubmed/17185360>17185360</a>", "Sessa", "Noncoding RNA synthesis and loss of Polycomb group repression accompanies the colinear activation of the human HOXA cluster.", "2007"]]|
|4175|;|Literature|;|1|;|0|;|0|;|[["Pub Med ID", "Author", "Title", "Year"], ["<a href=http://www.ncbi.nlm.nih.gov/pubmed/17445766>17445766</a>", "Sasaki", "Coordinated expression of ncRNAs and HOX mRNAs in the human HOXA locus.", "2007"], ["<a href=http://www.ncbi.nlm.nih.gov/pubmed/17451645>17451645</a>", "Sasaki", "Identification and characterization of human non-coding RNAs with tissue-specific expression.", "2007"], ["<a href=http://www.ncbi.nlm.nih.gov/pubmed/21423168>21423168</a>", "Wang", "A long noncoding RNA maintains active chromatin to coordinate homeotic gene expression.", "2011"]]|
|4256|;|Literature|;|1|;|0|;|0|;|[["Pub Med ID", "Author", "Title", "Year"], ["<a href=http://www.ncbi.nlm.nih.gov/pubmed/21874018>21874018</a>", "Guttman", "lincRNAs act in the circuitry controlling pluripotency and differentiation.", "2011"], ["<a href=http://www.ncbi.nlm.nih.gov/pubmed/20436462>20436462</a>", "Guttman", "Ab initio reconstruction of cell type-specific transcriptomes in mouse reveals the conserved multi-exonic structure of lincRNAs.", "2010"]]|
|4172|;|Literature|;|1|;|0|;|0|;|[["Pub Med ID", "Author", "Title", "Year"], ["<a href=http://www.ncbi.nlm.nih.gov/pubmed/12573261>12573261</a>", "Noonan", "Antisense transcripts at the EMX2 locus in human and mouse.", "2003"], ["<a href=http://www.ncbi.nlm.nih.gov/pubmed/20066053>20066053</a>", "Spigoni", "Regulation of Emx2 expression by antisense transcripts in murine cortico-cerebral precursors.", "2010"], ["<a href=http://www.ncbi.nlm.nih.gov/pubmed/21128942>21128942</a>", "Michelhaugh", "Mining Affymetrix microarray data for long noncoding RNAs: altered expression in the nucleus accumbens of heroin abusers.", "2010"]]|
|4254|;|Literature|;|1|;|0|;|0|;|[["Pub Med ID", "Author", "Title", "Year"], ["<a href=http://www.ncbi.nlm.nih.gov/pubmed/20624288>20624288</a>", "Chodroff", "Long noncoding RNA genes: conservation of sequence and brain expression among diverse amniotes.", "2010"], ["<a href=http://www.ncbi.nlm.nih.gov/pubmed/21890647>21890647</a>", "Cabili", "Integrative annotation of human large intergenic noncoding RNAs reveals global properties and specific subclasses.", "2011"]]|
|4255|;|Literature|;|1|;|0|;|0|;|[["Pub Med ID", "Author", "Title", "Year"], ["<a href=http://www.ncbi.nlm.nih.gov/pubmed/20624288>20624288</a>", "Chodroff", "Long noncoding RNA genes: conservation of sequence and brain expression among diverse amniotes.", "2010"], ["<a href=http://www.ncbi.nlm.nih.gov/pubmed/20062813>20062813</a>", "Uhde", "Rmst is a novel marker for the mouse ventral mesencephalic floor plate and the anterior dorsal midline cells.", "2010"], ["<a href=http://www.ncbi.nlm.nih.gov/pubmed/22406755>22406755</a>", "Clark", "Genome-wide analysis of long noncoding RNA stability.", "2012"]]|
|4183|;|Literature|;|1|;|0|;|0|;|[["Pub Med ID", "Author", "Title", "Year"], ["<a href=http://www.ncbi.nlm.nih.gov/pubmed/17241883>17241883</a>", "Panzitt", "Characterization of HULC, a novel gene with striking up-regulation in hepatocellular carcinoma, as noncoding RNA.", "2007"], ["<a href=http://www.ncbi.nlm.nih.gov/pubmed/19445043>19445043</a>", "Matouk", "Highly upregulated in liver cancer noncoding RNA is  overexpressed in hepatic colorectal metastasis.", "2009"], ["<a href=http://www.ncbi.nlm.nih.gov/pubmed/20423907>20423907</a>", "Wang", "CREB up-regulates long non-coding RNA, HULC expression through interaction with microRNA-372 in liver cancer.", "2010"]]|
|4187|;|Literature|;|1|;|0|;|0|;|[["Pub Med ID", "Author", "Title", "Year"], ["<a href=http://www.ncbi.nlm.nih.gov/pubmed/20577206>20577206</a>", "Poliseno", "A coding-independent function of gene and pseudogene mRNAs regulates tumour biology.", "2010"], ["<a href=http://www.ncbi.nlm.nih.gov/pubmed/20400965>20400965</a>", "Alimonti", "Subtle variations in Pten dose determine cancer susceptibility.", "2010"], ["<a href=http://www.ncbi.nlm.nih.gov/pubmed/23435381>23435381</a>", "Johnsson", "A pseudogene long-noncoding-RNA network regulates PTEN transcription and translation in human cells.", "2013"]]|
|4185|;|Literature|;|1|;|0|;|0|;|[["Pub Med ID", "Author", "Title", "Year"], ["<a href=http://www.ncbi.nlm.nih.gov/pubmed/20010688>20010688</a>", "Swiezewski", "Cold-induced silencing by long antisense transcripts of an Arabidopsis Polycomb target.", "2009"], ["<a href=http://www.ncbi.nlm.nih.gov/pubmed/21127216>21127216</a>", "Heo", "Vernalization-mediated epigenetic silencing by a long intronic noncoding RNA.", "2011"]]|
|4098|;|Literature|;|1|;|0|;|0|;|[["Pub Med ID", "Author", "Title", "Year"], ["<a href=http://www.ncbi.nlm.nih.gov/pubmed/19144990>19144990</a>", "Zhang", "A myelopoiesis-associated regulatory intergenic noncoding RNA transcript within the human HOXA cluster.", "2009"], ["<a href=http://www.ncbi.nlm.nih.gov/pubmed/17445766>17445766</a>", "Sasaki", "Coordinated expression of ncRNAs and HOX mRNAs in the human HOXA locus.", "2007"], ["<a href=http://www.ncbi.nlm.nih.gov/pubmed/17185360>17185360</a>", "Sessa", "Noncoding RNA synthesis and loss of Polycomb group repression accompanies the colinear activation of the human HOXA cluster.", "2007"], ["<a href=http://www.ncbi.nlm.nih.gov/pubmed/21874018>21874018</a>", "Guttman", "lincRNAs act in the circuitry controlling pluripotency and differentiation.", "2011"]]|
|4229|;|Literature|;|1|;|0|;|0|;|[["Pub Med ID", "Author", "Title", "Year"], ["<a href=http://www.ncbi.nlm.nih.gov/pubmed/17274687>17274687</a>", "Pagano", "New small nuclear RNA gene-like transcriptional units as sources of regulatory transcripts.", "2007"]]|
|4228|;|Literature|;|1|;|0|;|0|;|[["Pub Med ID", "Author", "Title", "Year"], ["<a href=http://www.ncbi.nlm.nih.gov/pubmed/20404130>20404130</a>", "Mondal", "Characterization of the RNA content of chromatin.", "2010"]]|
|4164|;|Literature|;|1|;|0|;|0|;|[["Pub Med ID", "Author", "Title", "Year"], ["<a href=http://www.ncbi.nlm.nih.gov/pubmed/9027504>9027504</a>", "Liu", "The human NTT gene: identification of a novel 17-kb noncoding nuclear RNA expressed in activated CD4+ T cells.", "1997"]]|
