TranscriptID;section;description;order
199;Function;"LINoCR expression was necessary for chromatin remodeling to switch the lysozyme regulatory region into an active confirmation. 

CTCF protein acts to repress transcription of the lysozyme gene.

Repression of LINoCR expression prevented eviction of CTCF from the -2.4kb element as well as histone modifications of this site and positioning of a nucelosome over the CTCF binding site. This demonstrated that LINoCR expression was necessary for CTCF eviction.

Whether the LINoCR transcript has a function or if it is simply the act of transcription which is necessary is unknown. ";4
199;Name;"LINoCR: LPS Inducible NonCoding RNA";1
199;Conservation;"Identified in chicken.";5
200;Characteristics;"Short interspersed element (SINE) repeat present in more than 10^5 copies in the mouse genome (<a href=""http://www.ncbi.nlm.nih.gov/pubmed/370792"">Kramerov (1979)</a>)

Repeat is ~180nuc long (<a href=""http://www.ncbi.nlm.nih.gov/pubmed/6296779"">Krayev (1982)</a>) but expressed B2 RNAs vary from ~0.2-0.6kb (<a href=""http://www.ncbi.nlm.nih.gov/pubmed/6130513"">Kramerov (1982)</a>,<a href=""http://www.ncbi.nlm.nih.gov/pubmed/2426659"">Fornace (1986)</a>). 

The 5' of B2 SINE is derived from a tRNA (<a href=""http://www.ncbi.nlm.nih.gov/pubmed/3839306"">Lawrence (1985)</a>, <a href=""http://www.ncbi.nlm.nih.gov/pubmed/3851163"">Daniels (1985)</a>) while the 3' contains an A rich sequence (<a href=""http://www.ncbi.nlm.nih.gov/pubmed/6296779"">Krayev (1982)</a>).

Transcribed by RNA polymerase III (<a href=""http://www.ncbi.nlm.nih.gov/pubmed/6296779"">Krayev (1982)</a>, <a href=""http://www.ncbi.nlm.nih.gov/pubmed/2581137"">Singh (1985)</a>).";1
200;Expression;"Expression highly induced upon viral infection (<a href=""http://www.ncbi.nlm.nih.gov/pubmed/2581137"">Singh (1985)</a>), heat shock (<a href=""http://www.ncbi.nlm.nih.gov/pubmed/2426659"">Fornace (1986)</a>) and differentially regulated during development (<a href=""http://www.ncbi.nlm.nih.gov/pubmed/2461884"">Bachvarova (1988)</a>).

Also shows higher expression in some tumour cells (<a href=""http://www.ncbi.nlm.nih.gov/pubmed/6130513"">Kramerov (1982)</a>).

Found in the nucleus (<a href=""http://www.ncbi.nlm.nih.gov/pubmed/15300239"">Espinoza (2004)</a>) and the cytoplasm (<a href=""http://www.ncbi.nlm.nih.gov/pubmed/6130513"">Kramerov (1982)</a>).";2
200;Function;"B2 SINE RNA is a specific inhibitor of RNA polymerase II (<a href=""http://www.ncbi.nlm.nih.gov/pubmed/15300240"">Allen (2004)</a>).

During heat shock B2 RNA associated with RNA polymerase II and repressed its action. Nb: Only saw association of B2 RNA with RNA polymerase II after heat shock. (<a href=""http://www.ncbi.nlm.nih.gov/pubmed/15300240"">Allen (2004)</a>).

Represses transcription by stably binding an RNA docking site on the core polymerase II complex and blocking activity of the RNA polymerase preinitiation complex (<a href=""http://www.ncbi.nlm.nih.gov/pubmed/15300239"">Espinoza (2004)</a>). To achieve this B2 RNA disrupts polymerase DNA binding at the promoter, preventing the formation of an active closed complex around the DNA (<a href=""http://www.ncbi.nlm.nih.gov/pubmed/19307572"">Yakovchuk (2009)</a>).

51 nucleotide sequence from 3' half is sufficient for binding to and repressing RNA polymerase II (<a href=""http://www.ncbi.nlm.nih.gov/pubmed/17307818"">Espinoza (2007)</a>).";3
200;Conservation;"Rodents: mouse, rat, chinese hamster (<a href=""http://www.ncbi.nlm.nih.gov/pubmed/6296779"">Krayev (1982)</a>)";4
200;Misc;"Known that upon heat shock RNA polymerase II is transiently repressed.

In humans Alu repeat RNAs appear to play the role B2 RNA does in rodents upon heat shock. Alu and B2 elements have different origins but show convergent evolution functionally.

B2 sequence provided is 177nt sequence specified by Espinoza et al. 2004 as mouse B2 RNA gene (region 121488-121665 of Mus musculus chromosome 18, clone RP23-6p18, GenBank accession number AC020972).";5
201;Characteristics;"Along with DISC1 identified as a gene disrupted by translocation in a family with schizophrenia (<a href=""http://www.ncbi.nlm.nih.gov/pubmed/10814723"">Millar (2000)</a>).

Antisense to DISC1, and covers one DISC1 exon (<a href=""http://www.ncbi.nlm.nih.gov/pubmed/10814723"">Millar (2000)</a>).

Contains a number of repeat sequences. SINEs, LINES and a DNA transposon (<a href=""http://www.ncbi.nlm.nih.gov/pubmed/10814723"">Millar (2000)</a>).

Exact length and structure not certain. Described as unspliced and may be more than 15kb long. Polyadenylated. (<a href=""http://www.ncbi.nlm.nih.gov/pubmed/10814723"">Millar (2000)</a>).";1
201;Expression;"Expressed in adult heart, saw transcripts of >9.5, ~6, ~3 and ~2.5kb (<a href=""http://www.ncbi.nlm.nih.gov/pubmed/10814723"">Millar (2000)</a>).

Detected in several fetal tissues including heart and brain (<a href=""http://www.ncbi.nlm.nih.gov/pubmed/10814723"">Millar (2000)</a>). ";2
201;Conservation;"Identified in humans, not found in mouse (<a href=""http://www.ncbi.nlm.nih.gov/pubmed/12573262"">Taylor (2003)</a>).";4
201;Misc;"Genebank accession for 15kb genomic sequence corresponding to DISC2: AF222981.1

Refseq lists DISC2 as a 3.9kb unspliced RNA. Accession: NR_002227.2";5
201;Name;"DISC2: Disrupted-In-Schizophrenia 2 ";0
202;Characteristics;"Found within the Tmevpg3 genetic locus which controls Theiler's virus persistance/ load (<a href=""http://www.ncbi.nlm.nih.gov/pubmed/11735227"">Vigneau (2001)</a>).

Promoter contains binding sites for E2A and the Ets family of transcription factors. Suggesting regulation by transcription factors involved in the immune system (<a href=""http://www.ncbi.nlm.nih.gov/pubmed/11735227"">Vigneau (2001)</a>).

Spliced with 5 or 6 exons depending on isoform/ species (<a href=""http://www.ncbi.nlm.nih.gov/pubmed/11735227"">Vigneau (2001)</a>).";1
202;Expression;"In resistant mice Tmevpg1 is constitutively expressed in CD4+ and CD8+immune cells in the spleen and thymus and upon infection, by immune cells infiltrating into the CNS, however no Tmevpg1 expression was seen in susceptible mice (<a href=""http://www.ncbi.nlm.nih.gov/pubmed/11735227"">Vigneau (2001)</a>, <a href=""http://www.ncbi.nlm.nih.gov/pubmed/12719555"">Vigneau (2003)</a>).

Found in peripheral blood lymphocytes in humans with expression in NK+ cells, CD4+ and CD8+ T-lymphocytes (<a href=""http://www.ncbi.nlm.nih.gov/pubmed/11735227"">Vigneau (2001)</a>, <a href=""http://www.ncbi.nlm.nih.gov/pubmed/12719555"">Vigneau (2003)</a>).

In both mouse and humans Tmevpg1 was down-regulated upon immune cell activation with a reciprocal up-regulation in interferon gamma (Ifng) expression (<a href=""http://www.ncbi.nlm.nih.gov/pubmed/12719555"">Vigneau (2003)</a>). ";2
202;Function;"It has been speculated there may be a regulatory regulationship between Tmevpg1 and Ifng to explain their reciprocal expression (<a href=""http://www.ncbi.nlm.nih.gov/pubmed/12719555"">Vigneau (2003)</a>).";3
202;Conservation;"Present in mouse and human. Sequence conservation is limited to the promoter, first exons and its splice site, otherwise the transcripts are poorly conserved and can contain repeat elements (<a href=""http://www.ncbi.nlm.nih.gov/pubmed/11735227"">Vigneau (2001)</a>).";4
202;Misc;"The Tmevpg3 genetic locus was found to control persistence of Theiler's virus in the central nervous system, along with the H-2D gene, this QTL locus was found to be near but exclude the interferon gamma (Ifng) gene (<a href=""http://www.ncbi.nlm.nih.gov/pubmed/10224268"">Bihl (1999)</a>).";5
202;Name;"Tmevpg1: Theiler's murine encephalomyelitis virus persistence candidate gene 1";0
203;Characteristics;"Anti-sense to DLG2 intron.

~4.5kb and ~7kb unspliced transcripts differ in 3' position.

Contains a number of repeat sequences.

Despite its position in an intron, promoter elements could be identified upstream of the Dlg2as start site.";1
203;Expression;"Expression downregulated in multiple brain regions in some patients with schizophrenia (by PCR).

Expression identified in a number of brain areas (by northern blot).

Near ubiquitous expression was identified in different brain areas and tissues (by PCR).

Some care must be taken interpreting the RT-PCR expression results as they appear to have been carried out with random hexamers and therefore may not differentiate between Dlg2as levels and detectable levels Dlg2 intron/ Dlg2 pre-mRNA. However the northern blot analysis does confirm expression of discrete transcripts from this intronic locus in different brain areas.";2
203;Conservation;"Sequence shows less than 50% homology with mouse.";4
203;Misc;"Genbank accession: AF525782.1 for Dlg2as is incorrectly listed as an mRNA but is actually a ~10kb genomic clone containing Dlg2as.

Exact start and stop not defined but:
Longer isoform (~7kb) appears to end around: chr11:84,604,583 (hg19)
Shorter isoform (~4.5kb) around: chr11:84,602,058 (hg19)";5
203;Name;"DLG2AS: DLG2 antisense RNA
PSZA11q14: putative schizophrenia associated gene from 11q14";0
204;Characteristics;"Four noncoding RNAs from the RAY1/ST7 gene locus. Complex gene locus with a large number of coding and noncoding isoforms. 

ST7OT1 & 2 are antisense to ST7. ST7OT3 & 4 are on the sense strand.

ST7OT1 - ~2kb unspliced antisense transcript that initiates in intron 1 of ST7, covers the first exon and terminates in the ST7 promoter region. Polyadenylated. Nb: it also overlaps exon 1 of ST7OT4.

ST7OT2 - Spliced antisense transcripts. Multiple isoforms that share either some 5' or some 3' exons. Isoforms are between 900-1300 bp, with 4-6 exons and polyadenlyated.

ST7OT3 - Spliced ~1kb transcript. Begins in intron 10 of ST7, shares exons 11-13 and sometimes 14 & 15 with ST7 plus has a number of unique exons. Some exons may also act as a alternative 3' end for ST7.

ST7OT4 - Multiple spliced transcripts within the long first intron of ST7. However, Refseq ST7OT4 transcript may be protein coding. Transcription begins just ~200bp downstream from the end of first ST7 exon.";1
204;Expression;"ST7OT1 - abundantly expressed in testis, also expressed in cerebellum, skeletal muscle, uterus, cerebellum, spinal cord, fetal brain, and prostate.

ST7OT2 - testis, fetal brain, cerebellum, mammary gland, fibroblasts.

ST7OT3 - expression only detected in cerebellum.

ST7OT4 - no expression detected.";2
204;Conservation;"ST7OT1 - some conserved sequence with mouse, most of this is where ST7OT1 overlaps the first exon of ST7 however.

ST7OT2 - 3' end of some isoforms shows some conservation with mouse.

ST7OT3 - some conserved sequence, most of this is shared exons with ST7 though.

ST7OT4 - sequence not conserved with mouse.";4
204;Misc;"ST7OT1 - NCBI Gene ID: 93653
ST7OT2 - NCBI Gene ID: 93654
ST7OT3 - NCBI Gene ID: 93655
ST7OT4 - NCBI Gene ID: 338069";5
206;Characteristics;"Spliced transcript from bidirectional promoter with Igf2. Overlaps some Igf2 isoforms in antisense direction (mouse and human).

~4.8kb mouse transcript, four exons. Multiple splice isoforms in human, 2 or 3 exons, ~2 or ~2.8kb. Most homology is towards 3' of transcripts (<a href=""http://www.ncbi.nlm.nih.gov/pubmed/10731720"">Okutsu (2000)</a>).";1
206;Expression;"Imprinted, expressed from paternal allele (<a href=""http://www.ncbi.nlm.nih.gov/pubmed/10731720"">Okutsu (2000)</a>). Igf2as generally retains imprinting in tumours even when Igf2 becomes bi-allelically expressed (<a href=""http://www.ncbi.nlm.nih.gov/pubmed/12702581"">Vu (2003)</a>). 

Ubiquitously, but lowly, expressed in human adult and fetal tissues. 2 exon (has retained intron) isoform was specific to adult liver (<a href=""http://www.ncbi.nlm.nih.gov/pubmed/12702581"">Vu (2003)</a>). 

Like Igf2, Igf2as showed highly up-regulated expression in Wilms tumour samples compared to neighbouring normal kidney tissue. ";2
206;Function;"SNP polymorphisms in Igf2as associate with increased muscle damage (strength loss and soreness) after eccentric exercise, as do SNPs found in IGF2 (<a href=""http://www.ncbi.nlm.nih.gov/pubmed/17289909"">Devaney (2007)</a>).";3
206;Conservation;"Human Igf2as contains a predicted ORF, however this is not present in mouse (<a href=""http://www.ncbi.nlm.nih.gov/pubmed/10731720"">Okutsu (2000)</a>).

Also expressed and imprinted in pig (<a href=""http://www.ncbi.nlm.nih.gov/pubmed/19571260"">Bischoff (2009)</a>).";4
206;Name;"IGF2AS: Insulin-like growth factor 2 antisense 
PEG8: Paternally expressed gene 8";0
207;NULL;"Annotation in Progress";0
207;Expression;"Ubiquitously expressed in humans. From part of Snurf-Snrpn domain that shows ubiquitous human expression (<a href=""http://www.ncbi.nlm.nih.gov/pubmed/20016068"">Vitali (2010)</a>)

Host transcript for multiple snoRNA genes.

Mouse RNA stability was close to median for lncRNAs, with a half-life of 3.2 hr in N2A (neuroblastoma) cells (<a href=""http://www.ncbi.nlm.nih.gov/pubmed/22406755"">Clark (2012)</a>). ";2
207;Name;"Imprinted in Prader-Willi syndrome";1
208;NULL;"Annotation in Progress

[[

RNAs of unknown identity associate with prion protein PrP, and participate in the conversion of human cellular PrP to its altered infectious conformation.

]]";0
209;Characteristics;"LncRNA transcripts from promoter of fbp1+ gene.

Three transcripts A to C.  Expressed in sense direction. Unspliced.

Transcript A initiates furthest upstream from fbp1+ start site, B and C initiate progressively closer to fbp1+. 

Although they are transcribed into fbp1+, A-C do not necessarily cover the whole coding sequence and no detectable protein was produced.";1
209;Expression;"Transiently expressed upon glucose starvation before fbp1+ is switched on.

A shows very low constitutive expression and is expressed up to 20 min after glucose starvation. B expressed from 10-60 min, C from 20-60 min. 

NB: fbp1+ switches on after 60 min.
";2
209;Function;"Transcription of ncRNAs was required for opening of chromatin and activation of fbp1+ transcription.

Progressive movement of transcription from 5' to 3' towards the fbp1+ start site correlates with chromatin remodeling to open up DNA and RNA polymerase II movement.

Termination of upstream transcription prevented chromatin remodeling and fbp1+ induction, showing the necessity of the noncoding cascade in activating transcription.

Unknown if lncRNAs themselves are carrying out a function.";3
209;Conservation;"Identified in fission yeast: Schizosaccharomyces pombe";4
210;Characteristics;"~2.4kb

Appears to be antisense. Covers PHO5 gene region and promoter.";1
210;Expression;"Expressed during high phosphate conditions when PHO5 is repressed.

Transcript degraded by the exosome and accumulates in exosome mutants.";2
210;Function;"LncRNA transcription involved in remodeling the PHO5 promoter and activation of the gene.

Loss of ncRNA transcription delayed nucleosome eviction and RNA polymerase II recruitment to the PHO5 promoter, showing it was necessary for proper activation.

Note: shows that transcription which generates short lived/ exosome degraded transcripts can be functionally relevant. Although it not known if the transcript itself is functional.";3
210;Misc;"The PHO5 gene encodes a protein involved in phosphate metabolism that is repressed under high phosphate conditions and activated under phosphate starvation.";4
211;Characteristics;"Antisense to PHO84.

2 transcripts, one covers the entire PHO84 gene, the other is longer and extends into the YML122C (a short hypothetical ORF) locus. Both initiate transcription near the 3' of PHO84. ";1
211;Expression;"There was low expression of antisense transcripts constitutively but abundance increased in aged cells as PHO84 was silenced.

PHO84 antisense transcripts are degraded by the exosome, but increased in abundance in aged cells due to transcript stabilisation. ";2
211;Function;"Summary: Silences PHO84 in aged cells

In aged cells exosome dissociates from PHO84 locus allowing the stabilisation and accumulation of PHO84 antisense transcripts.

Antisense RNAs recruit the histone deacetylase complex (Hda1, Hda2, Hda3) to the PHO84 locus, causing deacetylation and PHO84 silencing.

Blocking expression of full length PHO84 antisense transcripts prevented PHO84 silencing, demonstrating the antisense transcripts (not just transcription) was necessary for silencing. 

Nb: not clear if PHO84 antisense binds HDAC complex directly.";3
211;Misc;"PHO84 is an inorganic phosphate transporter";5
212;NULL;"**Annotation in Progress**";0
212;Characteristics;"Family of RNAs.

In legumes, it encodes a conserved 10–25 amino acid peptide, and contains up to six inverted repeats (IRs) (Girard et al. 2003).";1
212;Expression;"***The Enod40 family is expressed in differentiating cells of the primordial nodule (Yang et al. 1993; Crespi et al. 1994), but also has varying levels of expression in all parts of the plant, particularly the vascular system, where its expression correlates with the emergence of lateral roots and emerging leaves (Vleghels et al. 2003, Kouchi et al. 1999, Varkonyi-Gasic and White 2002).***

Expression regulated by growth conditions affecting root tissues  (<a href=""http://www.ncbi.nlm.nih.gov/pubmed/15037734"">Campalans (2004)</a>).";2
212;Function;"ENOD40 transcripts are required for correct subcellular localization of RNP particles in legume plants (<a href=""http://www.ncbi.nlm.nih.gov/pubmed/15037734"">Campalans (2004)</a>).";3
212;Conservation;N/A;4
212;Misc;N/A;5
213;Characteristics;"~0.5kb. Unspliced, polyadenylated. Alternative polyadenylation may give rise to different isoforms of ~510 and ~440 nt (excluding polyA tail).";1
213;Expression;"Mainly cytoplasmic but when bound to Mei2p becomes mainly nuclear localised in the Mei2p nuclear granule/ dot structure.

Expression of meiRNA is induced by nitrogen starvation in Schizosaccharomyces pombe, which causes a switch from the mitotic cell cycle to meiosis that is dependent on mei2.
";2
213;Function;"meiRNA specifically binds (both in-vivo and in-vitro) and is required for nuclear localisation of Mei2, which is an RNA-binding protein essential for premeiotic RNA synthesis and meiosis. Mei2p relocalises to nuclear granules/dot structures after binding to meiRNA, resulting in a cell switch from mitosis to meiosis.

Overexpression of meiRNA suppresses a temperature-sensitive defect of mei2+.

Mei2-meiRNA complex functions specifically at Meiosis I, and loss of function of meiRNA blocks meiosis, but not premeiotic DNA synthesis. ";3
213;Misc;"Mei2 may interact with other regulatory RNAs. A Mei2 defective in RNA binding cannot promote meiosis, and causes premeiotic DNA synthesis inhibition. In addition, the cytoplasmic function of Mei2, which is independent of meiRNA, is also abrogated in the RNA-binding mutant.";5
214;Characteristics;"~3.1kb, spliced, 2 exon transcript. 

Starts ~15kb upstream and on the opposite strand to p21 (Cdkn1a) gene in mouse.";1
214;Expression;"Transcriptional target of p53. P53 binds to the lincRNA-p21 promoter and up-regulates expression upon DNA damage and in various tumour cell lines.

Enriched in nucleus.

Complete length and structure of human lincRNA-p21 not defined, but it too appears to be regulated by p53.

Mouse RNA was stable with a half-life of 6.2 hr in in N2A (neuroblastoma) cells, well above the median lncRNA half-life (<a href=""http://www.ncbi.nlm.nih.gov/pubmed/22406755"">Clark (2012)</a>).";2
214;Function;"LincRNA-p21 acts to repress many genes transcriptionally regulated by p53.

LincRNA-p21 gene repression is mediated (at least in part) by lincRNA binding to heterogeneous nuclear ribonucleoprotein K (hnRNP-K) through its 5' end. hnRNP-K associates with the promoters of many genes repressed by lincRNA-p21 in a lincRNA-p21 dependent manner.

LincRNA-p21 is necessary for p53-dependent apoptotic induction, but not cell cycle arrest.
";3
214;Conservation;"At least some sequences within lincRNA-p21 are well conserved in mammals.";4
214;Misc;"Nb: Cdkn1a (p21) cell cycle regulator is also a p53 target gene.";5
215;Characteristics;"At4: member of a family of RNAs induced by phosphate (Pi) starvation in plants that have a region of complementarity to miR-399 and short non-conserved ORFs (<a href=""http://www.ncbi.nlm.nih.gov/pubmed/9880366"">Burleigh (1999)</a>, <a href=""http://www.ncbi.nlm.nih.gov/pubmed/16460506"">Shin (2006)</a>, <a href=""http://www.ncbi.nlm.nih.gov/pubmed/17643101"">Franco-Zorrilla (2007)</a>).

Other family members in Arabidopsis are At4-1, At4-2, At4-3 and <a href=""http://www.lncrnadb.com/Detail.aspx?TKeyid=158"">IPS1</a> (<a href=""http://www.ncbi.nlm.nih.gov/pubmed/16460506"">Shin (2006)</a>, <a href=""http://www.ncbi.nlm.nih.gov/pubmed/17643101"">Franco-Zorrilla (2007)</a>).

At4 is ~750nuc (<a href=""http://www.ncbi.nlm.nih.gov/pubmed/9880366"">Burleigh (1999)</a>).";1
215;Expression;"Expression of At4 family members is induced upon Pi starvation (<a href=""http://www.ncbi.nlm.nih.gov/pubmed/9880366"">Burleigh (1999)</a>, <a href=""http://www.ncbi.nlm.nih.gov/pubmed/17643101"">Franco-Zorrilla (2007)</a>).

At4 is expressed in roots (<a href=""http://www.ncbi.nlm.nih.gov/pubmed/9880366"">Burleigh (1999)</a>) and shoots (<a href=""http://www.ncbi.nlm.nih.gov/pubmed/11123795"">Martín (2000)</a>).

Hormonal signaling by cytokinins and abscisic acid repressed At4 expression in the roots (<a href=""http://www.ncbi.nlm.nih.gov/pubmed/11123795"">Martín (2000)</a>, <a href=""http://www.ncbi.nlm.nih.gov/pubmed/16460506"">Shin (2006)</a>).";2
215;Function;"Loss of At4 lead to increased shoot Pi content and an increase in the shoot:root Pi ratio under low Pi conditions suggesting At4 affects Pi distribution and plant growth (<a href=""http://www.ncbi.nlm.nih.gov/pubmed/16460506"">Shin (2006)</a>).

Competing endogenous RNA (ceRNA). At4 has complementarity to miR-399, but contains a central mismatch loop. Over-expression of At4 lead to a decrease in shoot Pi content suggesting that, like IPS1, At4 inhibits miR-399 through target mimicry thereby allowing activity of PHO2 (<a href=""http://www.ncbi.nlm.nih.gov/pubmed/17643101"">Franco-Zorrilla (2007)</a>).

At4 and IPS1 appear to be functionally redundant as overexpression of one gave same phenotypic change as overexpression of both (<a href=""http://www.ncbi.nlm.nih.gov/pubmed/17643101"">Franco-Zorrilla (2007)</a>).";3
215;Conservation;"At4 and IPS1 are paralogs in Arabidopsis.

At4 only shares homology with other family members (ie: At4-1 and At4-2, Mt4 in Medicago truncatula and Mt4-like in Glycine max) in the miR-399 complementarity region (<a href=""http://www.ncbi.nlm.nih.gov/pubmed/9880366"">Burleigh (1999)</a>, <a href=""http://www.ncbi.nlm.nih.gov/pubmed/16460506"">Shin (2006)</a>).";4
215;Misc;"Accession for other family members:
At4-1: AY536062; At4-2: AY334555; At4-3: AI995459";5
216;NULL;"hsr omega: heat shock RNA omega";0
216;Characteristics;"Product of the 93D (or hsr-omega) locus, one of the largest heat-shock puffs in Drosophila polytene chromosomes. This locus produces three major long transcripts (by alternative polyadenylation and splicing) in all Drosophila species examined (reviewed in <a href=""http://www.ncbi.nlm.nih.gov/pubmed/17020918"">Jolly (2006)</a>). The locus spans 10–20 kb, composed of two small exons (~475 and 700 bp in Drosophila melanogaster) separated by a 700 bp intron, and followed by a long stretch (5–15 kb) of short (280 bp in D. melanogaster) tandem repeat units (<a href=""http://www.ncbi.nlm.nih.gov/pubmed/17020918"">Jolly (2006)</a>).

Long noncoding transcripts produced include three major hsr-omega transcripts, which share the same 5' end (<a href=""http://www.ncbi.nlm.nih.gov/pubmed/1704862"">Bendena (1991)</a>, <a href=""http://www.ncbi.nlm.nih.gov/pubmed/3097014"">Garbe (1986)</a>):

Hsr-omega-n (omega-1) is >10kb-long and nuclear transcript that covers the entire length of the gene (including the tandem repeats), is polyadenylated, and retains the intron.

Hsr-omega-c (omega-3 ) is 1.2-kb, spliced and cytoplasmic. 

The third common RNA, omega-pre-c (omega-2) is spliced to produce the mature omega-c transcript. It is 1.9kb-long and terminates at a first polyadenylation site located at the 3' end of exon 2.";1
216;Expression;"Transcripts are constitutively expressed at relatively high levels in many tissues, in almost all cell types analysed, and are developmentally regulated (<a href=""http://www.ncbi.nlm.nih.gov/pubmed/11255511"">Lakhotia (2001)</a>)(<a href=""http://www.ncbi.nlm.nih.gov/pubmed/1704862"">Bendena (1991)</a>)(<a href=""http://www.ncbi.nlm.nih.gov/pubmed/8641048"">Mutsuddi (1995)</a>).

Transcripts were not detected in gonadal cell types such as male and female gonial cells and in follicle cells and oocytes in ovary. Polytenised tissues such as salivary glands, and certain regions of larval gut and the Malpighian tubules, showed a greater abundance of hsr-omega transcripts with a strong hybridization in nuclei (<a href=""http://www.ncbi.nlm.nih.gov/pubmed/1704862"">Bendena (1991)</a>). 

Expression is stress-induced, being highly active after heat exposure, but also responsive to other stresses such as amides benzamide and colchicine (<a href=""http://www.ncbi.nlm.nih.gov/pubmed/9364937"">Tapadia (1997)</a>).

Nuclear hsr-omega-n is localized in nuclear granules called omega-speckles (<a href=""http://www.ncbi.nlm.nih.gov/pubmed/17114940"">Sengupta (2007)</a>, <a href=""http://www.ncbi.nlm.nih.gov/pubmed/1704862"">Bendena (1991)</a>, <a href=""http://www.ncbi.nlm.nih.gov/pubmed/10984439"">Prasanth (2000)</a>).";2
