TranscriptID;section;description;order
158;Expression;"Expression induced upon phosphate starvation and accumulates into the roots and shoots (<a href=""http://www.ncbi.nlm.nih.gov/pubmed/11123795"">Martín (2000)</a>).

Hormonal signaling by cytokinins repressed IPS1 expression in the roots (<a href=""http://www.ncbi.nlm.nih.gov/pubmed/11123795"">Martín (2000)</a>).";3
158;Function;"IPS1 has complementarity to miR-399, but contains a mismatch loop that renders it uncleavable when miR-399 binds. Since target cleavage is the usual plant miRNA pathway the non-cleavable nature of IPS1 acts to sequester the miRNA (<a href=""http://www.ncbi.nlm.nih.gov/pubmed/17643101"">Franco-Zorrilla (2007)</a>).

Competing endogenous RNA (ceRNA). IPS1 carries out target mimicry to sequester miR-399 and attenuate its effects allowing increased expression of miR-399 targets including PHO2 (<a href=""http://www.ncbi.nlm.nih.gov/pubmed/17643101"">Franco-Zorrilla (2007)</a>).";4
158;Conservation;"IPS1 family members have been identified in a number of plant species (<a href=""http://www.ncbi.nlm.nih.gov/pubmed/9106510"">Liu (1997)</a>, <a href=""http://www.ncbi.nlm.nih.gov/pubmed/9207836"">Burleigh (1997)</a>, <a href=""http://www.ncbi.nlm.nih.gov/pubmed/9880366"">Burleigh (1999)</a>, <a href=""http://www.ncbi.nlm.nih.gov/pubmed/11123795"">Martín (2000)</a>, <a href=""http://www.ncbi.nlm.nih.gov/pubmed/16460506"">Shin (2006)</a>, <a href=""http://www.ncbi.nlm.nih.gov/pubmed/17643101"">Franco-Zorrilla (2007)</a>). 

However apart from At4 and IPS1 homology between family members is generally limited to the miR-399 binding site (<a href=""http://www.ncbi.nlm.nih.gov/pubmed/9880366"">Burleigh (1999)</a>, <a href=""http://www.ncbi.nlm.nih.gov/pubmed/16460506"">Shin (2006)</a>).";5
158;Misc;"Other family members include <a href=""http://www.lncrnadb.com/detail.aspx?TKeyid=215"">At4</a>, <a href=""http://www.ncbi.nlm.nih.gov/nuccore/42741749"">At4-1</a>, <a href=""http://www.ncbi.nlm.nih.gov/nuccore/41396887"">At4-2</a> and <a href=""http://www.ncbi.nlm.nih.gov/nucest/5842364?report=genbank"">At4-3</a> in Arabidopsis thaliana (<a href=""http://www.ncbi.nlm.nih.gov/pubmed/9880366"">Burleigh (1999)</a>, <a href=""http://www.ncbi.nlm.nih.gov/pubmed/16460506"">Shin (2006)</a> <a href=""http://www.ncbi.nlm.nih.gov/pubmed/17643101"">Franco-Zorrilla (2007)</a>), <a href=""http://www.ncbi.nlm.nih.gov/nuccore/1009717?report=genbank"">TPS11</a>  in tomato (<a href=""http://www.ncbi.nlm.nih.gov/pubmed/9106510"">Liu (1997)</a>), <a href=""http://www.ncbi.nlm.nih.gov/nuccore/2231317"">Mt4</a> in Barrel Clover and Alfalfa (<a href=""http://www.ncbi.nlm.nih.gov/pubmed/9207836"">Burleigh (1997)</a>), Mt4-like in Soybean (<a href=""http://www.ncbi.nlm.nih.gov/pubmed/9880366"">Burleigh (1999)</a>). 
";5
158;Name;"IPS1: Induced by phosphate starvation 1";1
159;Characteristics;"Upstream from the RCC1 protein coding gene. Multiple SNHG3 splice isoforms exist, minority join RCC1, majority do not. Isoforms range from ~0.9kb to ~2.6kb in human.

Contain U17a and U17b snoRNAs in introns. 

SNHG3 contains a number of exonic Alu elements

Transcriptional start site has characteristics of 5' TOP gene family.";2
159;Expression;"Localised to cytoplasm.

Unlike SNHG1 it was not stabilised by translation inhibitors or associated with translating ribosomes and was unaffected by translation inhibitors.

Identified as expressed in mouse embryonic stem cells (<a href=""http://www.ncbi.nlm.nih.gov/pubmed/21874018"">Guttman (2011)</a>).

Transcript found to be unstable with a half-life <2 hr in mouse N2A (neuroblastoma) cells and human B cells (<a href=""http://www.ncbi.nlm.nih.gov/pubmed/19561200"">Friedel (2009)</a>, <a href=""http://www.ncbi.nlm.nih.gov/pubmed/22406755"">Clark (2012)</a>).";3
159;Conservation;"Not highly conserved, ~40-50% identity between mouse and human exons.";5
159;Name;"SNHG3: Small nucleolar RNA host gene 3";1
159;Function;"Involved in maintaining pluripotency in ESCs (<a href=""http://www.ncbi.nlm.nih.gov/pubmed/21874018"">Guttman (2011)</a>).

Knockdown in mECSs lead to down-regulation of Nanog, Sox2, Klf4 and Oct4 expression as well as changes to ESC morphology (<a href=""http://www.ncbi.nlm.nih.gov/pubmed/21874018"">Guttman (2011)</a>).

Snhg3 was found to interact with a number of chromatin binding proteins/complexes in mESCs including PRC1, PRC2, JARID1B and SUV39H1, with the general pattern being interaction with repressors of gene expression (<a href=""http://www.ncbi.nlm.nih.gov/pubmed/21874018"">Guttman (2011)</a>).";4
160;Characteristics;"Contains U50 and U50-like snoRNAs in introns (<a href=""http://www.ncbi.nlm.nih.gov/pubmed/10792466"">Tanaka (2000)</a>).

Alternatively spliced transcript (<a href=""http://www.ncbi.nlm.nih.gov/pubmed/10792466"">Tanaka (2000)</a>).

Refseq isoform is ~0.5kb in humans.

Transcriptional start site has characteristics of 5' TOP gene family (<a href=""http://www.ncbi.nlm.nih.gov/pubmed/10792466"">Tanaka (2000)</a>).";2
160;Expression;"Broadly expressed in human adult tissues.

Identified as enriched in the cytoplasm of human GM12878, HepG2, HUVEC and K562 cells bu nuclear enriched in HeLaS3 (<a href=""http://www.ncbi.nlm.nih.gov/pubmed/22955988"">Derrien (2012)</a>).

RNA is unstable with a half-life <2 hr in mouse N2A (neuroblastoma) and 3T3 cells and a half-life ~2 hr in human B cells  (<a href=""http://www.ncbi.nlm.nih.gov/pubmed/19561200"">Friedel (2009)</a>, <a href=""http://www.ncbi.nlm.nih.gov/pubmed/22406755"">Clark (2012)</a>).";3
160;Conservation;"Mouse has two transcripts at syntenic loci which are separated by several hundred kb and contain U50. Some sequence similarity is found between then so it is likely they share a common ancestor (<a href=""http://www.ncbi.nlm.nih.gov/pubmed/17468437"">Tanaka-Fujita (2007)</a>).

Comparing mouse and human host transcripts revealed they were ""dissimilar"". It was hypothesized that the host transcripts share a common ancestor but there has been little selection for maintaining the sequence the host gene exons (<a href=""http://www.ncbi.nlm.nih.gov/pubmed/17468437"">Tanaka-Fujita (2007)</a>). ";4
160;Misc;"SNHG5 forms a novel translocation breakpoint with Bcl6 in a diffuse large B-cell (DLB) lymphoma, although it is unclear if SNHG5 contributed to malignancy (<a href=""http://www.ncbi.nlm.nih.gov/pubmed/10792466"">Tanaka (2000)</a>).";5
160;Name;"SNHG5: Small nucleolar RNA host gene 5";1
161;Characteristics;"Spliced transcript with U87 snoRNA in second intron. 

~0.5kb transcript

Transcriptional start site has characteristics of 5' TOP gene family.";2
161;Expression;"Broad expression in human and mouse tissues.

Localises mostly to the cytoplasm 

Human transcript found to show greater stability that SNHG1 in Hela cells (<a href=""http://www.ncbi.nlm.nih.gov/pubmed/16226852"">Makarova (2005)</a>). Also found to be quite stable in human B cells with a half-life of 7 hr, while mouse Snhg6 was significantly less stable (half-life 2.2hrs in 3T3 cells), suggesting the transcripts may have different stabilities between species (<a href=""http://www.ncbi.nlm.nih.gov/pubmed/19561200"">Friedel (2009)</a>, <a href=""http://www.ncbi.nlm.nih.gov/pubmed/22406755"">Clark (2012)</a>). 

Minority of SNHG6 associates with monosomes. 

Blocking translation led to a very modest increase in SNHG6 levels, in contrast to SNHG1 (which showed a large increase in transcript level) suggesting it is not very sensitive to nonsense mediated decay. This may help explain its increased stability. ";3
161;Function;"Unknown, however the authors point out that 5' TOP family genes are important for translation and that ribosomal associated SNHGs could be involved in this process as well.";3
161;Conservation;"Host gene sequence shows more conservation between species than other SNHG RNAs with conservation similar to levels of mRNA 3'UTRs.

Conserved between human, mouse, rat and dog.";4
161;Name;"SNHG6: Small nucleolar RNA host gene 6";1
162;Characteristics;"Upstream from the Matrin 3 protein coding gene. A number of splice isoforms of SNHG4 exist, some of which join Matrin3 and so act as an upstream initiation site for Matrin 3. 

SNHG4 specific isoforms appear to contain the first four SNHG4 exons and differ at the 3' end.

Contains U19 snoRNA in intron 3 (annotated as SNORA74A in Refseq).

Transcriptional start site has characteristics of the 5' TOP gene family.";2
162;Expression;"Expressed in a number of adult human tissues.

Shows a nucleoplasmic localisation. In constrast to other SNHG RNA (SNHG1, SNHG3)  which are localised in the cytoplasm.

Human SNHG4 isoforms 1&2 were highly stable in B cells (half-life >8 hr), while mouse Snhg4 was highly unstable in mouse 3T3 cells, suggesting differential stability between species (<a href=""http://www.ncbi.nlm.nih.gov/pubmed/19561200"">Friedel (2009)</a>, <a href=""http://www.ncbi.nlm.nih.gov/pubmed/22406755"">Clark (2012)</a>).";3
162;Conservation;"Likely present in mouse with same relationship with Matrin 3";4
162;Name;"SNHG4: Small nucleolar RNA host gene 4";1
163;Characteristics;"Messenger RNA that encodes the p53 protein, but also has a role as regulatory RNA that interacts with Mdm2 protein, controlling its function and p53 gene expression.";1
163;Expression;N/A;2
163;Function;"""p53 mRNA region that interacts with the Mdm2 RING domain also encodes the amino acids which bind the N-terminus of Mdm2 protein""";3
163;Conservation;N/A;4
163;Misc;"p53 is a key tumour suppressor gene which ""<a href=""http://www.ncbi.nlm.nih.gov/gene/7157"">responds to diverse cellular stresses to regulate target genes that induce cell cycle arrest, apoptosis, senescence, DNA repair, or changes in metabolism</a>"". MDM2 is an important regulator of p53, with binding of MDM2 protein to p53 protein promoting p53 degradation.";5
164;Characteristics;"17kb, polyadenylated, but not spliced. 

Sense intronic to Phosphodiesterase 7B, also covers one exon.

Contains a number of repeats, mostly near the 3 end.";1
164;Expression;"Expressed in activated, but not resting, CD4+ T cells. Also found in stimulated peripheral blood mononuclear cells (PBMC) and CD8+ T cells.

Localisation is predominately nuclear.

Shows a similar expression pattern to the interferon-gamma receptor gene, found ~1Mb away, which may suggest a co-regulation of the two transcripts in immune cell activation/development.";2
164;Conservation;"Has short regions of conserved sequence.";4
164;Misc;"Phosphodiesterase 7B is a cAMP-specific phosphodiesterase, a member of the cyclic nucleotide phosphodiesterase family. Involved in cAMP and cGMP signaling.

Sequence given is from genomic DNA, which corresponded to results from RT-PCR and RACE.";5
164;Name;"NTT: noncoding transcript in T cells.";0
165;Characteristics;"~480 nuc (<a href=""http://www.ncbi.nlm.nih.gov/pubmed/9858482"">Peyman (1999)</a>), independent transcript from the 3' end of the Neat1 short isoform/MEN epsilon.

Contains a number of sequence motifs that match binding sites for proteins involved in cytokine signalling which up-regulate MHC genes (<a href=""http://www.ncbi.nlm.nih.gov/pubmed/9858482"">Peyman (1999)</a>). ";1
165;Expression;"Expressed exclusively in the placenta and pancreas while full length Neat1 is expressed ubiquitously. Placenta was the only tissue where TncRNA predominated (<a href=""http://www.ncbi.nlm.nih.gov/pubmed/9858482"">Peyman (1999)</a>). ";2
165;Function;"Suppressed induction of MHC class II antigens by interferon gamma and partially blocked constitutive and interferon gamma induced expression of MHC class I antigens and ICAM-I (<a href=""http://www.ncbi.nlm.nih.gov/pubmed/9858482"">Peyman (1999)</a>, <a href=""http://www.ncbi.nlm.nih.gov/pubmed/12565840"">Geirsson (2003)</a>). 

Suppressed major histocompatibility (MHC) class II expression in-vitro through inhibition of class II transactivator (CIITA) promoters (<a href=""http://www.ncbi.nlm.nih.gov/pubmed/12565840"">Geirsson (2003)</a>, <a href=""http://www.ncbi.nlm.nih.gov/pubmed/12883198"">Geirsson (2003)</a>, <a href=""http://www.ncbi.nlm.nih.gov/pubmed/15454174"">Geirsson (2004)</a>). Also bound STAT1 and reduced its nuclear translocation (<a href=""http://www.ncbi.nlm.nih.gov/pubmed/9858482"">Peyman (1999)</a>), contributing to suppression of MHCII and I in human trophoblast cells and hence preventing a deleterious maternal immune response to placental invasion of the uterine wall.

Note: While STAT1 binds the CIITA promoter, it's binding did not appear to be affected by TncRNA, which acted on an area with no known transcription factor binding sites (<a href=""http://www.ncbi.nlm.nih.gov/pubmed/12883198"">Geirsson (2003)</a>), so the mechanism is unclear.";3
165;Misc;"This transcript comes from the very 3' end of the Neat1 short isoform. It is therefore part of Neat1 but as described above appears to be expressed independently with a function different to that of the full length transcript.";5
165;Name;"TncRNA: trophoblast noncoding RNA.
TSU: trophoblast STAT utron (untranslated region of an mRNA).";0
166;Characteristics;"7 known dUHGs (dUHG 1-5, 7-8), spliced noncoding RNAs that contain intronic snoRNAs (<a href=""http://www.ncbi.nlm.nih.gov/pubmed/11302516"">Tycowski (2001)</a>, <a href=""http://www.ncbi.nlm.nih.gov/pubmed/15987805"">Huang (2005)</a>). Nb: UHG6 identified as protein coding.

These 7 genes contain around half the known box C/D snoRNAs in Drosophila with snoRNAs in almost every intron (<a href=""http://www.ncbi.nlm.nih.gov/pubmed/15987805"">Huang (2005)</a>).

dUHG1 & 2 transcriptional start sites have characteristics of the 5' TOP gene family (<a href=""http://www.ncbi.nlm.nih.gov/pubmed/11302516"">Tycowski (2001)</a>).";2
166;Expression;"dUHG1 and 2 can be stabilised by inhibition of protein synthesis suggesting they are normally degraded by nonsense mediated decay (<a href=""http://www.ncbi.nlm.nih.gov/pubmed/11302516"">Tycowski (2001)</a>).";3
166;Conservation;"dUHG 1 and 2 contain snoRNAs that appear homologous to some of those found in UHG/SNHG1 and Gas5/SNHG2. Calling these genes homologous is not straightforward however, ie: both dUHG1 and 2 contain snoRNAs found in UHG, dUHG2 also contain snoRNAs found within introns of mammalian protein coding genes.";4
166;Name;"dUHG: Drosophila U snoRNA Host Gene.";1
166;Misc;"GeneID NCBI Entrez Gene
dUHG1: 3772106. dUHG2: 3772246. dUHG3: 3772557. dUHG4: 8673973. dUHG5: 8673975. dUHG7: 8674061. dUHG8: 8674065.  ";5
167;Characteristics;"~1.7kb transcript consisting of the first 1700nuc of 18s rRNA followed by 31bp of non rRNA sequence. 3' sequence contains a polyA signal and the transcript is polyadenylated.

Length and identity of transcript was confirmed by RT-PCR and northern blotting with a 3' probe.";2
167;Expression;"Expressed in a broad range of tissues.

Up-regulated in the spinal cord of SOD1 mutant mice prior to onset of amyotrophic lateral sclerosis (ALS) type symptoms.";3
167;Function;"In cell culture, mutations in SOD1 cause cell death, MSUR1 protect cells in a dose dependent manner and acts to decrease levels of hydroxl radicals and the oxidation of cellular proteins.

MSUR1 didn't affect the level of SOD1 protein, instead acting to reduce cellular oxidative stress. The mechanism of MSUR1 action is unknown.";4
167;Misc;"Mutations in superoxide dismutase (SOD1) are linked to amyotrophic lateral sclerosis (ALS) a fatal neurodegenerative condition. A mouse SOD1 mutant replicates this condition.

Genomic position of MSUR1 transcript not known.";5
167;Name;"MSUR1: mutant SOD1(G93A)-up-regulated RNA 1";1
169;Characteristics;"~5.5kb transcript originating from the 3'UTR of E2F4. Antisense to E2F4. ";1
169;Expression;"Localised to the nucleus and the cytoplasm although it is mainly cytoplasmic.

Expression identified in HCT116 colorectal carcinoma cells.

Expression is driven by Wnt signalling with beta-catenin and TCF/Lef binding to the E2F4 3'UTR to upregulate E2F4 antisense transcription.";2
169;Function;"Expression of E2F4 antisense lead to a decrease in E2F4 protein levels and reduced binding of E2F4 to its target gene promoters. This effect did not occur with, and could be blocked by, an E2F4 3'UTR sense construct.

Disruption of Wnt signalling is very common in colorectal cancer and it was hypothesised that induction of E2F4 antisense by Wnt signaling may contribute to carcinogenesis by reducing levels of the E2F4 cell cycle repressor.   ";3
169;Misc;"E2F4 acts in cell cycle controls where it is thought to act as a repressor of proliferation.

Neither the sequence nor exact coordinates of E2F4 antisense are available.";5
170;Characteristics;"0.4 - 3kb, spliced and present in multiple splicing isoforms (<a href=""http://www.ncbi.nlm.nih.gov/pubmed/17940140"">Dallosso (2007)</a>), as well as a protein coding isoform (WIT1) transcribed from a downstream promoter (<a href=""http://www.ncbi.nlm.nih.gov/pubmed/8208551"">Eccles (1994)</a>,<a href=""http://www.ncbi.nlm.nih.gov/pubmed/8290269"">Campbell (1994)</a>). Transcribed antisense to WT1 from intron 1 or from the same promoter region (bidirectional) of WT1, corresponding to a differentially methylated regulatory region (<a href=""http://www.ncbi.nlm.nih.gov/pubmed/8208551"">Eccles (1994)</a>,<a href=""http://www.ncbi.nlm.nih.gov/pubmed/7478583"">Malik (1995)</a>,<a href=""http://www.ncbi.nlm.nih.gov/pubmed/10811108"">Malik (2000)</a>).";1
170;Expression;"Imprinted in humans (but not in mouse), with monoallelic (paternal) expression in normal kidney (<a href=""http://www.ncbi.nlm.nih.gov/pubmed/10811108"">Malik (2000)</a>,<a href=""http://www.ncbi.nlm.nih.gov/pubmed/14681303"">Dallosso (2004)</a>,<a href=""http://www.ncbi.nlm.nih.gov/pubmed/17940140"">Dallosso (2007)</a>).

Co-regulation with WT1 during mouse kidney development, and co-expression in mouse and human tissues, including fetal spleen, fetal kidney, and normal kidney  (<a href=""http://www.ncbi.nlm.nih.gov/pubmed/17940140"">Dallosso (2007)</a>).

Abnormal splicing of WT1-AS has been reported in acute myeloid leukaemia (AML) samples (<a href=""http://www.ncbi.nlm.nih.gov/pubmed/17940140"">Dallosso (2007)</a>).";2
170;Function;"WT1-AS transcripts are exported to the cytoplasm and form heteroduplexes with WT1 mRNA, with a  proposed regulatory role in WT1 expression via RNA:RNA interactions (<a href=""http://www.ncbi.nlm.nih.gov/pubmed/17940140"">Dallosso (2007)</a>).";3
170;Conservation;"WT1 has a positionally conserved antisense/bidirectional transcripts in mouse and humans, although WT1-AS  RNAs do not show extensive sequence conservation between these species, except at their 5' ends, which may extend into WT1 exon 1 (<a href=""http://www.ncbi.nlm.nih.gov/pubmed/17940140"">Dallosso (2007)</a>).";4
170;Name;"
WT1-AS: WT1 (Wilms' tumor 1) antisense transcript";0
171;Characteristics;"Bidirectional promoter with HOXA11. Multiple splice isoforms are present which share a common 3' exon (<a href=""http://www.ncbi.nlm.nih.gov/pubmed/7789268"">Hsieh-Li (1995)</a>, <a href=""http://www.ncbi.nlm.nih.gov/pubmed/9745033"">Potter (1998)</a>), only some overlap HOXA11 (<a href=""http://www.ncbi.nlm.nih.gov/pubmed/9745033"">Potter (1998)</a>).

Annotated human isoform is ~1.6kb. A number of isoforms including ~1.4, ~1.9, ~2.9 and ~3.2kb transcripts have been identified in mouse (<a href=""http://www.ncbi.nlm.nih.gov/pubmed/7789268"">Hsieh-Li (1995)</a>).";1
171;Expression;"More highly expressed than HOXA11 in mouse development (<a href=""http://www.ncbi.nlm.nih.gov/pubmed/7789268"">Hsieh-Li (1995)</a>).

Expressed in developing limbs where it showed a complementary expression pattern to HOXA11 (<a href=""http://www.ncbi.nlm.nih.gov/pubmed/7789268"">Hsieh-Li (1995)</a>). Also expressed in fetal kidney (<a href=""http://www.ncbi.nlm.nih.gov/pubmed/9745033"">Potter (1998)</a>),  placenta, adult colon, muscle and prostate (<a href=""http://www.ncbi.nlm.nih.gov/pubmed/17185360"">Sessa (2007)</a>, <a href=""http://www.ncbi.nlm.nih.gov/pubmed/17445766"">Sasaki (2007)</a>). Shows collinear regulation of expression like HOX PTC genes (<a href=""http://www.ncbi.nlm.nih.gov/pubmed/17445766"">Sasaki (2007)</a>).

Expressed in same cell types as HOXA11 in the uterus. HOXA11as was dynamically expressed in the uterus during the menstrual cycle, with a peak in the endometrial late-proliferative phase, showing a pattern inverse to HOXA11 (<a href=""http://www.ncbi.nlm.nih.gov/pubmed/12050232"">Chau (2002)</a>). 

HOXA11as levels were down-regulated by progesterone in primary uterine stromal cells, which correlated with HOXA11 up-regulation in the same cells (<a href=""http://www.ncbi.nlm.nih.gov/pubmed/12050232"">Chau (2002)</a>). ";2
171;Function;"Due to the inverse or complementary expression pattern between Hoxa11 and HOXA11as mRNA expression levels, in the developing limbs (<a href=""http://www.ncbi.nlm.nih.gov/pubmed/7789268"">Hsieh-Li (1995)</a>) and adult endometrium (<a href=""http://www.ncbi.nlm.nih.gov/pubmed/12050232"">Chau (2002)</a>), HOXA11as has been proposed to negatively regulate Hoxa11 mRNA levels (<a href=""http://www.ncbi.nlm.nih.gov/pubmed/12050232"">Chau (2002)</a>).";3
171;Conservation;"Sequence highly conserved (<a href=""http://www.ncbi.nlm.nih.gov/pubmed/9745033"">Potter (1998)</a>), found throughout mammals.";4
171;Misc;"Some HOXA11as isoforms have long ORFs, however these ORFs are not conserved between human and mouse (despite high nucleotide sequence conservation) (<a href=""http://www.ncbi.nlm.nih.gov/pubmed/7789268"">Hsieh-Li (1995)</a>, <a href=""http://www.ncbi.nlm.nih.gov/pubmed/9745033"">Potter (1998)</a>). So while HOXA11as is thought to be noncoding, a possible role for HOXA11as encoding a protein cannot be completely discounted.";5
172;Characteristics;"5 kb. Spliced, bi-directional to Emx2, with a 271 nucleotide head-to-head antisense overlap. Riboprobe Northern blot indicates the existence of three additional Emx2os splicing isoforms differentially detected in the murine urogenital system, with sizes of 6.0, 2,3 and 1,8 kb, which are supported by cDNA evidence (<a href=""http://www.ncbi.nlm.nih.gov/pubmed/12573261"">Noonan (2003)</a>).";1
172;Expression;"EMX2 and EMX2OS and their murine orthologs have similar profiles and extensively coincident cellular expression patterns in the endometrium. Expressed in the uterus, abundant in normal postmenopausal endometrium, reduced in premenopausal endometrium (<a href=""http://www.ncbi.nlm.nih.gov/pubmed/12573261"">Noonan (2003)</a>).

Emx2os is expressed in the developing mouse CNS. Examination of expression at E10.5, E12.5, E14.5 and E18.5 showed, similar to Emx2, that its levels reduce progressively from E10.5 to E18.5. At E12.5, it is detected in a number of CNS structures also expressing Emx2 mRNA, such as the pallium and basal ganglia, mammillary recess of the hypothalamus, optic tectum, olfactory placode and otic vesicle. Emx2os is found in the developing telencephalon in periventricular proliferative layers and the cortical plate (<a href=""http://www.ncbi.nlm.nih.gov/pubmed/20066053"">Spigoni (2010)</a>).

However, the sense/antisense pair may also show mutually exclusive patterns, such as within the cortex. Emx2os is detected in periventricular precursors that also express Emx2, but peaks in newly born post-mitotic neurons, which do not express Emx2, whereas Emx2 is expressed Cajal-Retzius neurons lying in the marginal zone, which do not express the antisense RNA (<a href=""http://www.ncbi.nlm.nih.gov/pubmed/20066053"">Spigoni (2010)</a>).

In human brain, expression has been detected in normal nucleus accumbens (<a href=""http://www.ncbi.nlm.nih.gov/pubmed/21128942"">Michelhaugh (2010)</a>).";2
172;Function;"EMX2OS is suggested to regulate EMX2 expression (<a href=""http://www.ncbi.nlm.nih.gov/pubmed/12573261"">Noonan (2003)</a>), which may involve distinct regulatory mechanisms in different cell types (<a href=""http://www.ncbi.nlm.nih.gov/pubmed/20066053"">Spigoni (2010)</a>).

In vitro knock-down experiments indicate that Emx2os contributes to post-transcriptional down-regulation of its sense partner in cortical precursors and their neuronal progenies, possibly by a Dicer1-dependent process  (<a href=""http://www.ncbi.nlm.nih.gov/pubmed/20066053"">Spigoni (2010)</a>).

However, ectopic expression of a 5' fragment (OS1-179+) of Emx2os in neural precursors of the rhombo-spinal tract stimulates expression of Emx2, indicating a complex regulatory mechanism, perhaps at transcriptional level. In addition, Emx2 knock-out results in a strong reduction of Emx2os transcript levels, indicating a possible reciprocal regulatory loop (<a href=""http://www.ncbi.nlm.nih.gov/pubmed/20066053"">Spigoni (2010)</a>).";3
172;Conservation;"Association of Emx2os and Emx2 is conserved between mouse and humans, but no sequence conservation was found (<a href=""http://www.ncbi.nlm.nih.gov/pubmed/12573261"">Noonan (2003)</a>).";4
172;Misc;"EMX2OS lies in the minimal interval with allelic loss in endometrial tumors and is a candidate endometrial cancer tumor suppressor (<a href=""http://www.ncbi.nlm.nih.gov/pubmed/12573261"">Noonan (2003)</a>).";5
172;Name;"Emx2os: Emx2 opposite strand transcript.";0
173;Characteristics;"Found several antisense transcripts which initiate in the progesterone receptor (PR) promoter region. 

AT1 and AT3 were unspliced.

AT2-T47D and AT2-MCF7 were spliced with seven exons and transcribed over a 70kb region. AT2 isoforms initiated between the PR A and B start sites, had different (cell line specific) start sites but were otherwise identical. 

AT2-T47D ~1.35kb. AT2-MCF7 ~1.5kb.";2
173;Expression;"Expression identified in human breast cancer cell lines (MCF7 and T47D).

AT2 isoforms were the most highly expressed antisense transcripts.

AT2 isoforms could be detected in the nucleus.";3
