transcriptID;"concat(""<a href=http://www.ncbi.nlm.nih.gov/pubmed/"",pubmedID,"">"",pubmedID,""</a>"")";Author;Title;Year
78;"<a href=http://www.ncbi.nlm.nih.gov/pubmed/20668672>20668672</a>";Castle;"Digital genome-wide ncRNA expression, including SnoRNAs, across 11 human tissues using polyA-neutral amplification.";2010
190;"<a href=http://www.ncbi.nlm.nih.gov/pubmed/20668672>20668672</a>";Castle;"Digital genome-wide ncRNA expression, including SnoRNAs, across 11 human tissues using polyA-neutral amplification.";2010
140;"<a href=http://www.ncbi.nlm.nih.gov/pubmed/20668672>20668672</a>";Castle;"Digital genome-wide ncRNA expression, including SnoRNAs, across 11 human tissues using polyA-neutral amplification.";2010
96;"<a href=http://www.ncbi.nlm.nih.gov/pubmed/20668672>20668672</a>";Castle;"Digital genome-wide ncRNA expression, including SnoRNAs, across 11 human tissues using polyA-neutral amplification.";2010
93;"<a href=http://www.ncbi.nlm.nih.gov/pubmed/19217333>19217333</a>";Clemson;"An architectural role for a nuclear noncoding RNA: NEAT1 RNA is essential for the structure of paraspeckles.";2009
233;"<a href=http://www.ncbi.nlm.nih.gov/pubmed/18184812>18184812</a>";Mercer;"Specific expression of long noncoding RNAs in the mouse brain.";2008
140;"<a href=http://www.ncbi.nlm.nih.gov/pubmed/911771>911771</a>";Zieve;"Synthesis of two classes of small RNA species in vivo and in vitro.";1977
140;"<a href=http://www.ncbi.nlm.nih.gov/pubmed/6209580>6209580</a>";Ullu;"Alu sequences are processed 7SL RNA genes.";1984
125;"<a href=http://www.ncbi.nlm.nih.gov/pubmed/20436462>20436462</a>";Guttman;"Ab initio reconstruction of cell type-specific transcriptomes in mouse reveals the conserved multi-exonic structure of lincRNAs.";2010
89;"<a href=http://www.ncbi.nlm.nih.gov/pubmed/12461786>12461786</a>";Blume;"The 5'-untranslated RNA of the human dhfr minor transcript alters transcription pre-initiation complex assembly at the major (core) promoter.";2003
89;"<a href=http://www.ncbi.nlm.nih.gov/pubmed/2859520>2859520</a>";Masters;"Discrete human dihydrofolate reductase gene transcripts present in polysomal RNA map with their 5' ends several hundred nucleotides upstream of the main mRNA start site.";1985
116;"<a href=http://www.ncbi.nlm.nih.gov/pubmed/10888605>10888605</a>";Nemes;"The SCA8 transcript is an antisense RNA to a brain-specific transcript encoding a novel actin-binding protein (KLHL1).";2000
116;"<a href=http://www.ncbi.nlm.nih.gov/pubmed/16804541>16804541</a>";Moseley;"Bidirectional expression of CUG and CAG expansion transcripts and intranuclear polyglutamine inclusions in spinocerebellar ataxia type 8.";2006
116;"<a href=http://www.ncbi.nlm.nih.gov/pubmed/18708037>18708037</a>";Chen;"SCA8 mRNA expression suggests an antisense regulation of KLHL1 and correlates to SCA8 pathology.";2008
116;"<a href=http://www.ncbi.nlm.nih.gov/pubmed/19680539>19680539</a>";Daughters;"RNA gain-of-function in spinocerebellar ataxia type 8.";2009
202;"<a href=http://www.ncbi.nlm.nih.gov/pubmed/10224268>10224268</a>";Bihl;"Two loci, Tmevp2 and Tmevp3, located on the telomeric region of chromosome 10, control the persistence of Theiler's virus in the central nervous system of mice.";1999
100;"<a href=http://www.ncbi.nlm.nih.gov/pubmed/19838300>19838300</a>";Shiao;"An intergenic non-coding rRNA correlated with expression of the rRNA and frequency of an rRNA single nucleotide polymorphism in lung cancer cells.";2009
155;"<a href=http://www.ncbi.nlm.nih.gov/pubmed/20137068>20137068</a>";Mercer;"Long noncoding RNAs in neuronal-glial fate specification and oligodendrocyte lineage maturation.";2010
104;"<a href=http://www.ncbi.nlm.nih.gov/pubmed/20137068>20137068</a>";Mercer;"Long noncoding RNAs in neuronal-glial fate specification and oligodendrocyte lineage maturation.";2010
138;"<a href=http://www.ncbi.nlm.nih.gov/pubmed/20137068>20137068</a>";Mercer;"Long noncoding RNAs in neuronal-glial fate specification and oligodendrocyte lineage maturation.";2010
90;"<a href=http://www.ncbi.nlm.nih.gov/pubmed/20137068>20137068</a>";Mercer;"Long noncoding RNAs in neuronal-glial fate specification and oligodendrocyte lineage maturation.";2010
237;"<a href=http://www.ncbi.nlm.nih.gov/pubmed/20137068>20137068</a>";Mercer;"Long noncoding RNAs in neuronal-glial fate specification and oligodendrocyte lineage maturation.";2010
237;"<a href=http://www.ncbi.nlm.nih.gov/pubmed/18562676>18562676</a>";Dinger;"Long noncoding RNAs in mouse embryonic stem cell pluripotency and differentiation.";2008
237;"<a href=http://www.ncbi.nlm.nih.gov/pubmed/8812481>8812481</a>";McGuinness;"Sequence, organization, and transcription of the Dlx-1 and Dlx-2 locus.";1996
90;"<a href=http://www.ncbi.nlm.nih.gov/pubmed/9415433>9415433</a>";Liu;"Dlx genes encode DNA-binding proteins that are expressed in an overlapping and sequential pattern during basal ganglia differentiation.";1997
237;"<a href=http://www.ncbi.nlm.nih.gov/pubmed/9415433>9415433</a>";Liu;"Dlx genes encode DNA-binding proteins that are expressed in an overlapping and sequential pattern during basal ganglia differentiation.";1997
105;"<a href=http://www.ncbi.nlm.nih.gov/pubmed/9858482>9858482</a>";Peyman;"Repression of major histocompatibility complex genes by a human trophoblast ribonucleic acid.";1999
165;"<a href=http://www.ncbi.nlm.nih.gov/pubmed/12883198>12883198</a>";Geirsson;"Class II transactivator promoter activity is suppressed through regulation by a trophoblast noncoding RNA.";2003
213;"<a href=http://www.ncbi.nlm.nih.gov/pubmed/11423126>11423126</a>";Sato;"The fission yeast meiotic regulator Mei2p undergoes nucleocytoplasmic shuttling.";2001
213;"<a href=http://www.ncbi.nlm.nih.gov/pubmed/10021358>10021358</a>";Ohno;"Meiosis: MeiRNA hits the spot.";1999
90;"<a href=http://www.ncbi.nlm.nih.gov/pubmed/18562676>18562676</a>";Dinger;"Long noncoding RNAs in mouse embryonic stem cell pluripotency and differentiation.";2008
143;"<a href=http://www.ncbi.nlm.nih.gov/pubmed/6248245>6248245</a>";Keshet;"Heterogeneity of ""virus-like"" genes encoding retrovirus-associated 30S RNA and their organization within the mouse genome.";1980
93;"<a href=http://www.ncbi.nlm.nih.gov/pubmed/20797886>20797886</a>";Tripathi;"The Nuclear-Retained Noncoding RNA MALAT1 Regulates Alternative Splicing by Modulating SR Splicing Factor Phosphorylation.";2010
93;"<a href=http://www.ncbi.nlm.nih.gov/pubmed/19116412>19116412</a>";Sanford;"Splicing factor SFRS1 recognizes a functionally diverse landscape of RNA transcripts.";2009
238;"<a href=http://www.ncbi.nlm.nih.gov/pubmed/18997003>18997003</a>";"Ben Amor";"Novel long non-protein coding RNAs involved in Arabidopsis differentiation and stress responses.";2009
238;"<a href=http://www.ncbi.nlm.nih.gov/pubmed/16500993>16500993</a>";Hirsch;"Characterization of 43 non-protein-coding mRNA genes in Arabidopsis, including the MIR162a-derived transcripts.";2006
239;"<a href=http://www.ncbi.nlm.nih.gov/pubmed/18997003>18997003</a>";"Ben Amor";"Novel long non-protein coding RNAs involved in Arabidopsis differentiation and stress responses.";2009
239;"<a href=http://www.ncbi.nlm.nih.gov/pubmed/16500993>16500993</a>";Hirsch;"Characterization of 43 non-protein-coding mRNA genes in Arabidopsis, including the MIR162a-derived transcripts.";2006
79;"<a href=http://www.ncbi.nlm.nih.gov/pubmed/20716961>20716961</a>";Popov;"Epigenetic regulation of the INK4b-ARF-INK4a locus: In sickness and in health.";2010
223;"<a href=http://www.ncbi.nlm.nih.gov/pubmed/2436392>2436392</a>";Greenaway;"Nucleotide sequence of the most abundantly transcribed early gene of human cytomegalovirus strain AD169.";1987
223;"<a href=http://www.ncbi.nlm.nih.gov/pubmed/11932411>11932411</a>";Gawn;"Absence of IE1 p72 protein function during low-multiplicity infection by human cytomegalovirus results in a broad block to viral delayed-early gene expression.";2002
223;"<a href=http://www.ncbi.nlm.nih.gov/pubmed/12917473>12917473</a>";McSharry;"The most abundantly transcribed human cytomegalovirus gene (beta 2.7) is non-essential for growth in vitro.";2003
192;"<a href=http://www.ncbi.nlm.nih.gov/pubmed/16469056>16469056</a>";Farbrother;"Dictyostelium transcriptional host cell response upon infection with Legionella.";2006
216;"<a href=http://www.ncbi.nlm.nih.gov/pubmed/17114940>17114940</a>";Sengupta;"Altered expressions of the noncoding hsromega gene enhances poly-Q-induced neurotoxicity in Drosophila.";2007
216;"<a href=http://www.ncbi.nlm.nih.gov/pubmed/11255511>11255511</a>";Lakhotia;"Developmental regulation and complex organization of the promoter of the non-coding hsr(omega) gene of Drosophila melanogaster.";2001
216;"<a href=http://www.ncbi.nlm.nih.gov/pubmed/10984439>10984439</a>";Prasanth;"Omega speckles - a novel class of nuclear speckles containing hnRNPs associated with noncoding hsr-omega RNA in Drosophila.";2000
216;"<a href=http://www.ncbi.nlm.nih.gov/pubmed/11910129>11910129</a>";Rajendra;"Male sterility associated with overexpression of the noncoding hsromega gene in cyst cells of testis of Drosophila melanogaster.";2001
216;"<a href=http://www.ncbi.nlm.nih.gov/pubmed/19280368>19280368</a>";Johnson;"Protein synthesis rates in Drosophila associate with levels of the hsr-omega nuclear transcript.";2009
101;"<a href=http://www.ncbi.nlm.nih.gov/pubmed/16965397>16965397</a>";Nakano;"Expression profile of LIT1/KCNQ1OT1 and epigenetic status at the KvDMR1 in colorectal cancers.";2006
101;"<a href=http://www.ncbi.nlm.nih.gov/pubmed/10958646>10958646</a>";Horike;"Targeted disruption of the human LIT1 locus defines a putative imprinting control element playing an essential role in Beckwith-Wiedemann syndrome.";2000
240;"<a href=http://www.ncbi.nlm.nih.gov/pubmed/20558719>20558719</a>";Cazalla;"Down-regulation of a host microRNA by a Herpesvirus saimiri noncoding RNA.";2010
240;"<a href=http://www.ncbi.nlm.nih.gov/pubmed/20047990>20047990</a>";Buck;"Post-transcriptional regulation of miR-27 in murine cytomegalovirus infection.";2010
240;"<a href=http://www.ncbi.nlm.nih.gov/pubmed/15916956>15916956</a>";Cook;"Small nuclear RNAs encoded by Herpesvirus saimiri upregulate the expression of genes linked to T cell activation in virally transformed T cells.";2005
224;"<a href=http://www.ncbi.nlm.nih.gov/pubmed/11867523>11867523</a>";Nanbo;"Epstein-Barr virus RNA confers resistance to interferon-alpha-induced apoptosis in Burkitt's lymphoma.";2002
89;"<a href=http://www.ncbi.nlm.nih.gov/pubmed/7566158>7566158</a>";Akoulitchev;"Requirement for TFIIH kinase activity in transcription by RNA polymerase II.";1995
216;"<a href=http://www.ncbi.nlm.nih.gov/pubmed/2500443>2500443</a>";Fini;"Unusual behavior of the cytoplasmic transcript of hsr omega: an abundant, stress-inducible RNA that is translated but yields no detectable protein product.";1989
216;"<a href=http://www.ncbi.nlm.nih.gov/pubmed/9364937>9364937</a>";Tapadia;"Specific induction of the hsr omega locus of Drosophila melanogaster by amides.";1997
145;"<a href=http://www.ncbi.nlm.nih.gov/pubmed/16462745>16462745</a>";Williamson;"Identification of an imprinting control region affecting the expression of all transcripts in the Gnas cluster.";2006
190;"<a href=http://www.ncbi.nlm.nih.gov/pubmed/20404130>20404130</a>";Mondal;"Characterization of the RNA content of chromatin.";2010
216;"<a href=http://www.ncbi.nlm.nih.gov/pubmed/17020918>17020918</a>";Jolly;"Human sat III and Drosophila hsr omega transcripts: a common paradigm for regulation of nuclear RNA processing in stressed cells.";2006
216;"<a href=http://www.ncbi.nlm.nih.gov/pubmed/8306827>8306827</a>";Morcillo;"HSP90 associates with specific heat shock puffs (hsr omega) in polytene chromosomes of Drosophila and Chironomus.";1993
216;"<a href=http://www.ncbi.nlm.nih.gov/pubmed/3097014>3097014</a>";Garbe;"A Drosophila heat shock locus with a rapidly diverging sequence but a conserved structure.";1986
190;"<a href=http://www.ncbi.nlm.nih.gov/pubmed/17925858>17925858</a>";Young;"Cellular mRNA activates transcription elongation by displacing 7SK RNA.";2007
123;"<a href=http://www.ncbi.nlm.nih.gov/pubmed/8863726>8863726</a>";Farris;"Genes for murine Y1 and Y3 Ro RNAs have class 3 RNA polymerase III promoter structures and are unlinked on mouse chromosome 6.";1996
123;"<a href=http://www.ncbi.nlm.nih.gov/pubmed/20349053>20349053</a>";Boria;"Nematode sbRNAs: homologs of vertebrate Y RNAs.";2010
152;"<a href=http://www.ncbi.nlm.nih.gov/pubmed/16415074>16415074</a>";Haddad;"Regulation of antisense RNA expression during cardiac MHC gene switching in response to pressure overload.";2006
123;"<a href=http://www.ncbi.nlm.nih.gov/pubmed/6164096>6164096</a>";Lerner;"Two novel classes of small ribonucleoproteins detected by antibodies associated with lupus erythematosus.";1981
123;"<a href=http://www.ncbi.nlm.nih.gov/pubmed/7520568>7520568</a>";Maraia;"The human Y4 small cytoplasmic RNA gene is controlled by upstream elements and resides on chromosome 7 with all other hY scRNA genes.";1994
123;"<a href=http://www.ncbi.nlm.nih.gov/pubmed/9671049>9671049</a>";Green;"Binding of the 60-kDa Ro autoantigen to Y RNAs: evidence for recognition in the major groove of a conserved helix.";1998
123;"<a href=http://www.ncbi.nlm.nih.gov/pubmed/7688474>7688474</a>";O'Brien;"Xenopus Ro ribonucleoproteins: members of an evolutionarily conserved class of cytoplasmic ribonucleoproteins.";1993
123;"<a href=http://www.ncbi.nlm.nih.gov/pubmed/8041611>8041611</a>";"van Gelder";"Common structural features of the Ro RNP associated hY1 and hY5 RNAs.";1994
123;"<a href=http://www.ncbi.nlm.nih.gov/pubmed/7539809>7539809</a>";Matera;"A perinucleolar compartment contains several RNA polymerase III transcripts as well as the polypyrimidine tract-binding protein, hnRNP I.";1995
123;"<a href=http://www.ncbi.nlm.nih.gov/pubmed/17470436>17470436</a>";Perreault;"Ro-associated Y RNAs in metazoans: evolution and diversification.";2007
123;"<a href=http://www.ncbi.nlm.nih.gov/pubmed/18087752>18087752</a>";Mosig;"Evolution of the vertebrate Y RNA cluster.";2007
123;"<a href=http://www.ncbi.nlm.nih.gov/pubmed/7505620>7505620</a>";Pruijn;"Ro RNP associated Y RNAs are highly conserved among mammals.";1993
123;"<a href=http://www.ncbi.nlm.nih.gov/pubmed/7534247>7534247</a>";Farris;"Y3 is the most conserved small RNA component of Ro ribonucleoprotein complexes in vertebrate species.";1995
123;"<a href=http://www.ncbi.nlm.nih.gov/pubmed/10668799>10668799</a>";Bouffard;"Interaction cloning and characterization of RoBPI, a novel protein binding to human Ro ribonucleoproteins.";2000
123;"<a href=http://www.ncbi.nlm.nih.gov/pubmed/10785401>10785401</a>";Fabini;"Analysis of the molecular composition of Ro ribonucleoprotein complexes. Identification of novel Y RNA-binding proteins.";2000
123;"<a href=http://www.ncbi.nlm.nih.gov/pubmed/12096904>12096904</a>";Fouraux;"Nucleolin associates with a subset of the human Ro ribonucleoprotein complexes.";2002
123;"<a href=http://www.ncbi.nlm.nih.gov/pubmed/8752087>8752087</a>";Shi;"A misfolded form of 5S rRNA is complexed with the Ro and La autoantigens.";1996
123;"<a href=http://www.ncbi.nlm.nih.gov/pubmed/15907467>15907467</a>";Stein;"Structural insights into RNA quality control: the Ro autoantigen binds misfolded RNAs via its central cavity.";2005
123;"<a href=http://www.ncbi.nlm.nih.gov/pubmed/17041599>17041599</a>";Fuchs;"Structural and biochemical basis for misfolded RNA recognition by the Ro autoantigen.";2006
123;"<a href=http://www.ncbi.nlm.nih.gov/pubmed/9710533>9710533</a>";Pellizzoni;"Involvement of the Xenopus laevis Ro60 autoantigen in the alternative interaction of La and CNBP proteins with the 5'UTR of L4 ribosomal protein mRNA.";1998
123;"<a href=http://www.ncbi.nlm.nih.gov/pubmed/15817567>15817567</a>";Perreault;"Retropseudogenes derived from the human Ro/SS-A autoantigen-associated hY RNAs.";2005
123;"<a href=http://www.ncbi.nlm.nih.gov/pubmed/20012579>20012579</a>";Krude;"Non-coding RNAs: new players in the field of eukaryotic DNA replication.";2010
184;"<a href=http://www.ncbi.nlm.nih.gov/pubmed/9671709>9671709</a>";Liao;"Activities of adenovirus virus-associated RNAs: purification and characterization of RNA binding proteins.";1998
184;"<a href=http://www.ncbi.nlm.nih.gov/pubmed/20935053>20935053</a>";Parrott;"The evolution and expression of the snaR family of small non-coding RNAs.";2010
225;"<a href=http://www.ncbi.nlm.nih.gov/pubmed/20719943>20719943</a>";Funk;"RNA structures required for production of subgenomic flavivirus RNA.";2010
207;"<a href=http://www.ncbi.nlm.nih.gov/pubmed/11726556>11726556</a>";Runte;"The IC-SNURF-SNRPN transcript serves as a host for multiple small nucleolar RNA species and as an antisense RNA for UBE3A.";2001
207;"<a href=http://www.ncbi.nlm.nih.gov/pubmed/7849716>7849716</a>";Wevrick;"Identification of a novel paternally expressed gene in the Prader-Willi syndrome region.";1994
225;"<a href=http://www.ncbi.nlm.nih.gov/pubmed/20540055>20540055</a>";Lescrinier;"Structure determination of the top-loop of the conserved 3'-terminal secondary structure in the genome of flaviviruses.";2010
225;"<a href=http://www.ncbi.nlm.nih.gov/pubmed/9010281>9010281</a>";Urosevic;"Molecular characterization of virus-specific RNA produced in the brains of flavivirus-susceptible and -resistant mice after challenge with Murray Valley encephalitis virus.";1997
225;"<a href=http://www.ncbi.nlm.nih.gov/pubmed/15113895>15113895</a>";Lin;"Accumulation of a 3'-terminal genome fragment in Japanese encephalitis virus-infected mammalian and mosquito cells.";2004
225;"<a href=http://www.ncbi.nlm.nih.gov/pubmed/3016981>3016981</a>";Brinton;"The 3'-nucleotides of flavivirus genomic RNA form a conserved secondary structure.";1986
225;"<a href=http://www.ncbi.nlm.nih.gov/pubmed/16501108>16501108</a>";Scherbik;"RNase L plays a role in the antiviral response to West Nile virus.";2006
241;"<a href=http://www.ncbi.nlm.nih.gov/pubmed/21029862>21029862</a>";Tian;"The long noncoding RNA, jpx, is a molecular switch for x chromosome inactivation.";2010
241;"<a href=http://www.ncbi.nlm.nih.gov/pubmed/12045143>12045143</a>";Chureau;"Comparative sequence analysis of the X-inactivation center region in mouse, human, and bovine.";2002
241;"<a href=http://www.ncbi.nlm.nih.gov/pubmed/12160738>12160738</a>";Johnston;"Enox, a novel gene that maps 10 kb upstream of Xist and partially escapes X inactivation.";2002
104;"<a href=http://www.ncbi.nlm.nih.gov/pubmed/20404130>20404130</a>";Mondal;"Characterization of the RNA content of chromatin.";2010
242;"<a href=http://www.ncbi.nlm.nih.gov/pubmed/21057500>21057500</a>";Loewer;"Large intergenic non-coding RNA-RoR modulates reprogramming of human induced pluripotent stem cells.";2010
172;"<a href=http://www.ncbi.nlm.nih.gov/pubmed/21128942>21128942</a>";Michelhaugh;"Mining Affymetrix microarray data for long noncoding RNAs: altered expression in the nucleus accumbens of heroin abusers.";2010
104;"<a href=http://www.ncbi.nlm.nih.gov/pubmed/21128942>21128942</a>";Michelhaugh;"Mining Affymetrix microarray data for long noncoding RNAs: altered expression in the nucleus accumbens of heroin abusers.";2010
105;"<a href=http://www.ncbi.nlm.nih.gov/pubmed/21128942>21128942</a>";Michelhaugh;"Mining Affymetrix microarray data for long noncoding RNAs: altered expression in the nucleus accumbens of heroin abusers.";2010
93;"<a href=http://www.ncbi.nlm.nih.gov/pubmed/21128942>21128942</a>";Michelhaugh;"Mining Affymetrix microarray data for long noncoding RNAs: altered expression in the nucleus accumbens of heroin abusers.";2010
88;"<a href=http://www.ncbi.nlm.nih.gov/pubmed/21128942>21128942</a>";Michelhaugh;"Mining Affymetrix microarray data for long noncoding RNAs: altered expression in the nucleus accumbens of heroin abusers.";2010
88;"<a href=http://www.ncbi.nlm.nih.gov/pubmed/16710320>16710320</a>";Albertson;"Distinctive profiles of gene expression in the human nucleus accumbens associated with cocaine and heroin abuse.";2006
104;"<a href=http://www.ncbi.nlm.nih.gov/pubmed/16356785>16356785</a>";McLaughlin;"Expression pattern of the maternally imprinted gene Gtl2 in the forebrain during embryonic development and adulthood.";2006
104;"<a href=http://www.ncbi.nlm.nih.gov/pubmed/16793321>16793321</a>";Zhao;"Cyclic AMP stimulates MEG3 gene expression in cells through a cAMP-response element (CRE) in the MEG3 proximal promoter region.";2006
96;"<a href=http://www.ncbi.nlm.nih.gov/pubmed/3396539>3396539</a>";Pachnis;"The structure and expression of a novel gene activated in early mouse embryogenesis.";1988
96;"<a href=http://www.ncbi.nlm.nih.gov/pubmed/1303252>1303252</a>";Zemel;"Physical linkage of two mammalian imprinted genes, H19 and insulin-like growth factor 2.";1992
96;"<a href=http://www.ncbi.nlm.nih.gov/pubmed/19926638>19926638</a>";Tsang;"Oncofetal H19-derived miR-675 regulates tumor suppressor RB in human colorectal cancer.";2010
96;"<a href=http://www.ncbi.nlm.nih.gov/pubmed/20529846>20529846</a>";Dudek;"Type II collagen expression is regulated by tissue-specific miR-675 in human articular chondrocytes.";2010
243;"<a href=http://www.ncbi.nlm.nih.gov/pubmed/14962667>14962667</a>";Hernandez;"Complex organization and structure of sense and antisense transcripts expressed from the DIO3 gene imprinted locus.";2004
243;"<a href=http://www.ncbi.nlm.nih.gov/pubmed/16309881>16309881</a>";Tierling;"High-resolution map and imprinting analysis of the Gtl2-Dnchc1 domain on mouse chromosome 12.";2006
243;"<a href=http://www.ncbi.nlm.nih.gov/pubmed/16935842>16935842</a>";Kester;"Regulation of type III iodothyronine deiodinase expression in human cell lines.";2006
243;"<a href=http://www.ncbi.nlm.nih.gov/pubmed/17510246>17510246</a>";Hernandez;"Gene expression from the imprinted Dio3 locus is associated with cell proliferation of cultured brown adipocytes.";2007
244;"<a href=http://www.ncbi.nlm.nih.gov/pubmed/21057500>21057500</a>";Loewer;"Large intergenic non-coding RNA-RoR modulates reprogramming of human induced pluripotent stem cells.";2010
245;"<a href=http://www.ncbi.nlm.nih.gov/pubmed/21057500>21057500</a>";Loewer;"Large intergenic non-coding RNA-RoR modulates reprogramming of human induced pluripotent stem cells.";2010
213;"<a href=http://www.ncbi.nlm.nih.gov/pubmed/9778252>9778252</a>";Yamashita;"RNA-assisted nuclear transport of the meiotic regulator Mei2p in fission yeast.";1998
90;"<a href=http://www.ncbi.nlm.nih.gov/pubmed/17623775>17623775</a>";Sone;"The mRNA-like noncoding RNA Gomafu constitutes a novel nuclear domain in a subset of neurons.";2007
174;"<a href=http://www.ncbi.nlm.nih.gov/pubmed/21156811>21156811</a>";Hainer;"Intergenic transcription causes repression by directing nucleosome assembly.";2010
101;"<a href=http://www.ncbi.nlm.nih.gov/pubmed/21345374>21345374</a>";Kanduri;"Kcnq1ot1: A chromatin regulatory RNA.";2011
101;"<a href=http://www.ncbi.nlm.nih.gov/pubmed/15590939>15590939</a>";Paulsen;"Evolution of the Beckwith-Wiedemann syndrome region in vertebrates.";2005
101;"<a href=http://www.ncbi.nlm.nih.gov/pubmed/15459184>15459184</a>";Pandey;"NF-Y regulates the antisense promoter, bidirectional silencing, and differential epigenetic marks of the Kcnq1 imprinting control region.";2004
117;"<a href=http://www.ncbi.nlm.nih.gov/pubmed/16848684>16848684</a>";Hube;"Alternative splicing of the first intron of the steroid receptor RNA activator (SRA) participates in the generation of coding and noncoding RNA isoforms in breast cancer cell lines.";2006
102;"<a href=http://www.ncbi.nlm.nih.gov/pubmed/19056938>19056938</a>";Preker;"RNA exosome depletion reveals transcription upstream of active human promoters.";2008
84;"<a href=http://www.ncbi.nlm.nih.gov/pubmed/19056938>19056938</a>";Preker;"RNA exosome depletion reveals transcription upstream of active human promoters.";2008
174;"<a href=http://www.ncbi.nlm.nih.gov/pubmed/16484372>16484372</a>";Davis;"Accumulation of unstable promoter-associated transcripts upon loss of the nuclear exosome subunit Rrp6p in Saccharomyces cerevisiae.";2006
246;"<a href=http://www.ncbi.nlm.nih.gov/pubmed/18316478>18316478</a>";Berretta;"A cryptic unstable transcript mediates transcriptional trans-silencing of the Ty1 retrotransposon in S. cerevisiae.";2008
247;"<a href=http://www.ncbi.nlm.nih.gov/pubmed/19061643>19061643</a>";Houseley;"A ncRNA modulates histone modification and mRNA induction in the yeast GAL gene cluster.";2008
175;"<a href=http://www.ncbi.nlm.nih.gov/pubmed/21423168>21423168</a>";Wang;"A long noncoding RNA maintains active chromatin to coordinate homeotic gene expression.";2011
139;"<a href=http://www.ncbi.nlm.nih.gov/pubmed/20016068>20016068</a>";Vitali;"Long nuclear-retained non-coding RNAs and allele-specific higher-order chromatin organization at imprinted snoRNA gene arrays.";2010
207;"<a href=http://www.ncbi.nlm.nih.gov/pubmed/20016068>20016068</a>";Vitali;"Long nuclear-retained non-coding RNAs and allele-specific higher-order chromatin organization at imprinted snoRNA gene arrays.";2010
248;"<a href=http://www.ncbi.nlm.nih.gov/pubmed/21460236>21460236</a>";Askarian-Amiri;"SNORD-host RNA Zfas1 is a regulator of mammary development and a potential marker for breast cancer.";2011
122;"<a href=http://www.ncbi.nlm.nih.gov/pubmed/21172659>21172659</a>";Zhao;"Genome-wide identification of polycomb-associated RNAs by RIP-seq.";2010
113;"<a href=http://www.ncbi.nlm.nih.gov/pubmed/21172659>21172659</a>";Zhao;"Genome-wide identification of polycomb-associated RNAs by RIP-seq.";2010
119;"<a href=http://www.ncbi.nlm.nih.gov/pubmed/21172659>21172659</a>";Zhao;"Genome-wide identification of polycomb-associated RNAs by RIP-seq.";2010
145;"<a href=http://www.ncbi.nlm.nih.gov/pubmed/21172659>21172659</a>";Zhao;"Genome-wide identification of polycomb-associated RNAs by RIP-seq.";2010
96;"<a href=http://www.ncbi.nlm.nih.gov/pubmed/21172659>21172659</a>";Zhao;"Genome-wide identification of polycomb-associated RNAs by RIP-seq.";2010
