transcriptID;"concat(""<a href=http://www.ncbi.nlm.nih.gov/pubmed/"",pubmedID,"">"",pubmedID,""</a>"")";Author;Title;Year
142;"<a href=http://www.ncbi.nlm.nih.gov/pubmed/17704132>17704132</a>";Zhu;"A facilitated tracking and transcription mechanism of long-range enhancer function.";2007
124;"<a href=http://www.ncbi.nlm.nih.gov/pubmed/13679026>13679026</a>";Nelles;"Organization of the mouse Zfhx1b gene encoding the two-handed zinc finger repressor Smad-interacting protein-1.";2003
158;"<a href=http://www.ncbi.nlm.nih.gov/pubmed/17643101>17643101</a>";Franco-Zorrilla;"Target mimicry provides a new mechanism for regulation of microRNA activity.";2007
158;"<a href=http://www.ncbi.nlm.nih.gov/pubmed/9106510>9106510</a>";Liu;"Differential expression of TPS11, a phosphate starvation-induced gene in tomato.";1997
158;"<a href=http://www.ncbi.nlm.nih.gov/pubmed/9207836>9207836</a>";Burleigh;"A novel gene whose expression in Medicago truncatula roots is suppressed in response to colonization by vesicular-arbuscular mycorrhizal (VAM) fungi and to phosphate nutrition.";1997
158;"<a href=http://www.ncbi.nlm.nih.gov/pubmed/9880366>9880366</a>";Burleigh;"The down-regulation of Mt4-like genes by phosphate fertilization occurs systemically and involves phosphate translocation to the shoots.";1999
158;"<a href=http://www.ncbi.nlm.nih.gov/pubmed/11123795>11123795</a>";Martín;"Influence of cytokinins on the expression of phosphate starvation responsive genes in Arabidopsis.";2000
158;"<a href=http://www.ncbi.nlm.nih.gov/pubmed/16460506>16460506</a>";Shin;"Loss of At4 function impacts phosphate distribution between the roots and the shoots during phosphate starvation.";2006
155;"<a href=http://www.ncbi.nlm.nih.gov/pubmed/9671460>9671460</a>";Pelczar;"The host gene for intronic U17 small nucleolar RNAs in mammals has no protein-coding potential and is a member of the 5'-terminal oligopyrimidine gene family.";1998
159;"<a href=http://www.ncbi.nlm.nih.gov/pubmed/9671460>9671460</a>";Pelczar;"The host gene for intronic U17 small nucleolar RNAs in mammals has no protein-coding potential and is a member of the 5'-terminal oligopyrimidine gene family.";1998
160;"<a href=http://www.ncbi.nlm.nih.gov/pubmed/10792466>10792466</a>";Tanaka;"Intronic U50 small-nucleolar-RNA (snoRNA) host gene of no protein-coding potential is mapped at the chromosome breakpoint t(3;6)(q27;q15) of human B-cell lymphoma.";2000
161;"<a href=http://www.ncbi.nlm.nih.gov/pubmed/16226852>16226852</a>";Makarova;"Noncoding RNA of U87 host gene is associated with ribosomes and is relatively resistant to nonsense-mediated decay.";2005
162;"<a href=http://www.ncbi.nlm.nih.gov/pubmed/9630250>9630250</a>";Bortolin;"Human U19 intron-encoded snoRNA is processed from a long primary transcript that possesses little potential for protein coding.";1998
163;"<a href=http://www.ncbi.nlm.nih.gov/pubmed/19160491>19160491</a>";Candeias;"P53 mRNA controls p53 activity by managing Mdm2 functions.";2008
144;"<a href=http://www.ncbi.nlm.nih.gov/pubmed/19878653>19878653</a>";Hashimoto;"A liver X receptor (LXR)-beta alternative splicing variant (LXRBSV) acts as an RNA co-activator of LXR-beta.";2009
164;"<a href=http://www.ncbi.nlm.nih.gov/pubmed/9027504>9027504</a>";Liu;"The human NTT gene: identification of a novel 17-kb noncoding nuclear RNA expressed in activated CD4+ T cells.";1997
165;"<a href=http://www.ncbi.nlm.nih.gov/pubmed/15454174>15454174</a>";Geirsson;"Inhibition of alloresponse by a human trophoblast non-coding RNA suppressing class II transactivator promoter III and major histocompatibility class II expression in murine B-lymphocytes.";2004
165;"<a href=http://www.ncbi.nlm.nih.gov/pubmed/12565840>12565840</a>";Geirsson;"Human trophoblast noncoding RNA suppresses CIITA promoter III activity in murine B-lymphocytes.";2003
165;"<a href=http://www.ncbi.nlm.nih.gov/pubmed/9858482>9858482</a>";Peyman;"Repression of major histocompatibility complex genes by a human trophoblast ribonucleic acid.";1999
160;"<a href=http://www.ncbi.nlm.nih.gov/pubmed/17468437>17468437</a>";Tanaka-Fujita;"Human and mouse protein-noncoding snoRNA host genes with dissimilar nucleotide sequences show chromosomal synteny.";2007
155;"<a href=http://www.ncbi.nlm.nih.gov/pubmed/17468437>17468437</a>";Tanaka-Fujita;"Human and mouse protein-noncoding snoRNA host genes with dissimilar nucleotide sequences show chromosomal synteny.";2007
92;"<a href=http://www.ncbi.nlm.nih.gov/pubmed/17468437>17468437</a>";Tanaka-Fujita;"Human and mouse protein-noncoding snoRNA host genes with dissimilar nucleotide sequences show chromosomal synteny.";2007
92;"<a href=http://www.ncbi.nlm.nih.gov/pubmed/19232134>19232134</a>";Shao;"Genome-wide analysis of chicken snoRNAs provides unique implications for the evolution of vertebrate snoRNAs.";2009
166;"<a href=http://www.ncbi.nlm.nih.gov/pubmed/11302516>11302516</a>";Tycowski;"Non-coding snoRNA host genes in Drosophila: expression strategies for modification guide snoRNAs.";2001
166;"<a href=http://www.ncbi.nlm.nih.gov/pubmed/15987805>15987805</a>";Huang;"Genome-wide analyses of two families of snoRNA genes from Drosophila melanogaster, demonstrating the extensive utilization of introns for coding of snoRNAs.";2005
122;"<a href=http://www.ncbi.nlm.nih.gov/pubmed/8636206>8636206</a>";Clemson;"XIST RNA paints the inactive X chromosome at interphase: evidence for a novel RNA involved in nuclear/chromosome structure.";1996
167;"<a href=http://www.ncbi.nlm.nih.gov/pubmed/17957031>17957031</a>";Chang;"A novel noncoding RNA rescues mutant SOD1-mediated cell death.";2008
169;"<a href=http://www.ncbi.nlm.nih.gov/pubmed/17121828>17121828</a>";Yochum;"An antisense transcript induced by Wnt/beta-catenin signaling decreases E2F4.";2007
170;"<a href=http://www.ncbi.nlm.nih.gov/pubmed/14681303>14681303</a>";Dallosso;"Genomic imprinting at the WT1 gene involves a novel coding transcript (AWT1) that shows deregulation in Wilms' tumours.";2004
170;"<a href=http://www.ncbi.nlm.nih.gov/pubmed/17210670>17210670</a>";Hancock;"A CTCF-binding silencer regulates the imprinted genes AWT1 and WT1-AS and exhibits sequential epigenetic defects during Wilms' tumourigenesis.";2007
170;"<a href=http://www.ncbi.nlm.nih.gov/pubmed/17940140>17940140</a>";Dallosso;"Alternately spliced WT1 antisense transcripts interact with WT1 sense RNA and show epigenetic and splicing defects in cancer.";2007
170;"<a href=http://www.ncbi.nlm.nih.gov/pubmed/10811108>10811108</a>";Malik;"Identification of differential methylation of the WT1 antisense regulatory region and relaxation of imprinting in Wilms' tumor.";2000
171;"<a href=http://www.ncbi.nlm.nih.gov/pubmed/12050232>12050232</a>";Chau;"HOXA11 silencing and endogenous HOXA11 antisense ribonucleic acid in the uterine endometrium.";2002
171;"<a href=http://www.ncbi.nlm.nih.gov/pubmed/7789268>7789268</a>";Hsieh-Li;"Hoxa 11 structure, extensive antisense transcription, and function in male and female fertility.";1995
171;"<a href=http://www.ncbi.nlm.nih.gov/pubmed/9745033>9745033</a>";Potter;"Evolutionary conservation and tissue-specific processing of Hoxa 11 antisense transcripts.";1998
148;"<a href=http://www.ncbi.nlm.nih.gov/pubmed/12489151>12489151</a>";Berdal;"Msx1 homeogene antisense mRNA in mouse dental and bone cells.";2002
148;"<a href=http://www.ncbi.nlm.nih.gov/pubmed/16157866>16157866</a>";Coudert;"Expression and regulation of the Msx1 natural antisense transcript during development.";2005
172;"<a href=http://www.ncbi.nlm.nih.gov/pubmed/12573261>12573261</a>";Noonan;"Antisense transcripts at the EMX2 locus in human and mouse.";2003
172;"<a href=http://www.ncbi.nlm.nih.gov/pubmed/20066053>20066053</a>";Spigoni;"Regulation of Emx2 expression by antisense transcripts in murine cortico-cerebral precursors.";2010
173;"<a href=http://www.ncbi.nlm.nih.gov/pubmed/18604220>18604220</a>";Schwartz;"Antisense transcripts are targets for activating small RNAs.";2008
174;"<a href=http://www.ncbi.nlm.nih.gov/pubmed/15175754>15175754</a>";Martens;"Intergenic transcription is required to repress the Saccharomyces cerevisiae SER3 gene.";2004
174;"<a href=http://www.ncbi.nlm.nih.gov/pubmed/16291644>16291644</a>";Martens;"Regulation of an intergenic transcript controls adjacent gene transcription in Saccharomyces cerevisiae.";2005
174;"<a href=http://www.ncbi.nlm.nih.gov/pubmed/17074811>17074811</a>";Thompson;"Cytoplasmic decay of intergenic transcripts in Saccharomyces cerevisiae.";2007
175;"<a href=http://www.ncbi.nlm.nih.gov/pubmed/17445766>17445766</a>";Sasaki;"Coordinated expression of ncRNAs and HOX mRNAs in the human HOXA locus.";2007
175;"<a href=http://www.ncbi.nlm.nih.gov/pubmed/17451645>17451645</a>";Sasaki;"Identification and characterization of human non-coding RNAs with tissue-specific expression.";2007
98;"<a href=http://www.ncbi.nlm.nih.gov/pubmed/17445766>17445766</a>";Sasaki;"Coordinated expression of ncRNAs and HOX mRNAs in the human HOXA locus.";2007
171;"<a href=http://www.ncbi.nlm.nih.gov/pubmed/17445766>17445766</a>";Sasaki;"Coordinated expression of ncRNAs and HOX mRNAs in the human HOXA locus.";2007
171;"<a href=http://www.ncbi.nlm.nih.gov/pubmed/17185360>17185360</a>";Sessa;"Noncoding RNA synthesis and loss of Polycomb group repression accompanies the colinear activation of the human HOXA cluster.";2007
98;"<a href=http://www.ncbi.nlm.nih.gov/pubmed/17185360>17185360</a>";Sessa;"Noncoding RNA synthesis and loss of Polycomb group repression accompanies the colinear activation of the human HOXA cluster.";2007
176;"<a href=http://www.ncbi.nlm.nih.gov/pubmed/17445766>17445766</a>";Sasaki;"Coordinated expression of ncRNAs and HOX mRNAs in the human HOXA locus.";2007
176;"<a href=http://www.ncbi.nlm.nih.gov/pubmed/17185360>17185360</a>";Sessa;"Noncoding RNA synthesis and loss of Polycomb group repression accompanies the colinear activation of the human HOXA cluster.";2007
177;"<a href=http://www.ncbi.nlm.nih.gov/pubmed/17445766>17445766</a>";Sasaki;"Coordinated expression of ncRNAs and HOX mRNAs in the human HOXA locus.";2007
177;"<a href=http://www.ncbi.nlm.nih.gov/pubmed/17185360>17185360</a>";Sessa;"Noncoding RNA synthesis and loss of Polycomb group repression accompanies the colinear activation of the human HOXA cluster.";2007
178;"<a href=http://www.ncbi.nlm.nih.gov/pubmed/15703187>15703187</a>";Alfano;"Natural antisense transcripts associated with genes involved in eye development.";2005
180;"<a href=http://www.ncbi.nlm.nih.gov/pubmed/7710686>7710686</a>";Bedford;"Analysis of the Hoxd-3 gene: structure and localization of its sense and natural antisense transcripts.";1995
182;"<a href=http://www.ncbi.nlm.nih.gov/pubmed/18820242>18820242</a>";Korneev;"Novel noncoding antisense RNA transcribed from human anti-NOS2A locus is differentially regulated during neuronal differentiation of embryonic stem cells.";2008
183;"<a href=http://www.ncbi.nlm.nih.gov/pubmed/17241883>17241883</a>";Panzitt;"Characterization of HULC, a novel gene with striking up-regulation in hepatocellular carcinoma, as noncoding RNA.";2007
183;"<a href=http://www.ncbi.nlm.nih.gov/pubmed/19445043>19445043</a>";Matouk;"Highly upregulated in liver cancer noncoding RNA is  overexpressed in hepatic colorectal metastasis.";2009
183;"<a href=http://www.ncbi.nlm.nih.gov/pubmed/20423907>20423907</a>";Wang;"CREB up-regulates long non-coding RNA, HULC expression through interaction with microRNA-372 in liver cancer.";2010
184;"<a href=http://www.ncbi.nlm.nih.gov/pubmed/17855395>17855395</a>";Parrott;"Novel rapidly evolving hominid RNAs bind nuclear factor 90 and display tissue-restricted distribution.";2007
184;"<a href=http://www.ncbi.nlm.nih.gov/pubmed/20028844>20028844</a>";Parrott;"snaR genes: recent descendants of Alu involved in the evolution of chorionic gonadotropins.";2009
185;"<a href=http://www.ncbi.nlm.nih.gov/pubmed/20010688>20010688</a>";Swiezewski;"Cold-induced silencing by long antisense transcripts of an Arabidopsis Polycomb target.";2009
186;"<a href=http://www.ncbi.nlm.nih.gov/pubmed/1511174>1511174</a>";Potts;"Sense and antisense TGF beta 3 mRNA levels correlate with cardiac valve induction.";1992
187;"<a href=http://www.ncbi.nlm.nih.gov/pubmed/20577206>20577206</a>";Poliseno;"A coding-independent function of gene and pseudogene mRNAs regulates tumour biology.";2010
188;"<a href=http://www.ncbi.nlm.nih.gov/pubmed/12515386>12515386</a>";Michel;"UM 9(5)h and UM 9(5)p, human and porcine noncoding transcripts with preferential expression in the cerebellum.";2002
189;"<a href=http://www.ncbi.nlm.nih.gov/pubmed/16936730>16936730</a>";Abarrategui;"Regulation of T cell receptor-alpha gene recombination by transcription.";2006
189;"<a href=http://www.ncbi.nlm.nih.gov/pubmed/17882258>17882258</a>";Abarrategui;"Noncoding transcription controls downstream promoters to regulate T-cell receptor alpha recombination.";2007
140;"<a href=http://www.ncbi.nlm.nih.gov/pubmed/6181418>6181418</a>";Walter;"Signal recognition particle contains a 7S RNA essential for protein translocation across the endoplasmic reticulum.";1982
189;"<a href=http://www.ncbi.nlm.nih.gov/pubmed/8383995>8383995</a>";Shimizu;"Mouse germline transcript of TCR alpha joining region and temporal expression in ontogeny.";1993
189;"<a href=http://www.ncbi.nlm.nih.gov/pubmed/3500476>3500476</a>";"de Villartay";"Deletional rearrangement in the human T-cell receptor alpha-chain locus.";1987
189;"<a href=http://www.ncbi.nlm.nih.gov/pubmed/9247569>9247569</a>";Villey;"Germ-line transcription and methylation status of the TCR-J alpha locus in its accessible configuration.";1997
99;"<a href=http://www.ncbi.nlm.nih.gov/pubmed/20040589>20040589</a>";Kim;"Evidence for bacterial origin of heat shock RNA-1.";2010
140;"<a href=http://www.ncbi.nlm.nih.gov/pubmed/6802847>6802847</a>";Li;"Nucleotide sequence of 7 S RNA. Homology to Alu DNA and La 4.5 S RNA.";1982
140;"<a href=http://www.ncbi.nlm.nih.gov/pubmed/3403542>3403542</a>";Kleinert;"Differential regulation of transcription of human 7 S K and 7 S L RNA genes.";1988
140;"<a href=http://www.ncbi.nlm.nih.gov/pubmed/6084597>6084597</a>";Ullu;"Human genes and pseudogenes for the 7SL RNA component of signal recognition particle.";1984
190;"<a href=http://www.ncbi.nlm.nih.gov/pubmed/6196783>6196783</a>";Sohn;"7S-K nuclear RNA from simian virus 40-transformed cells has sequence homology to the viral early promoter.";1983
190;"<a href=http://www.ncbi.nlm.nih.gov/pubmed/11713533>11713533</a>";Nguyen;"7SK small nuclear RNA binds to and inhibits the activity of CDK9/cyclin T complexes.";2001
190;"<a href=http://www.ncbi.nlm.nih.gov/pubmed/11713532>11713532</a>";Yang;"The 7SK small nuclear RNA inhibits the CDK9/cyclin T1 kinase to control transcription.";2001
190;"<a href=http://www.ncbi.nlm.nih.gov/pubmed/6434539>6434539</a>";Reddy;"Primary and secondary structure of 7-3 (K) RNA of Novikoff hepatoma.";1984
190;"<a href=http://www.ncbi.nlm.nih.gov/pubmed/11864590>11864590</a>";Blencowe;"Transcription: surprising role for an elusive small nuclear RNA.";2002
190;"<a href=http://www.ncbi.nlm.nih.gov/pubmed/1646389>1646389</a>";Wassarman;"Structural analyses of the 7SK ribonucleoprotein (RNP), the most abundant human small RNP of unknown function.";1991
140;"<a href=http://www.ncbi.nlm.nih.gov/pubmed/10924331>10924331</a>";Stuart;"The 3' UTR of human MnSOD mRNA hybridizes to a small cytoplasmic RNA and inhibits gene expression.";2000
140;"<a href=http://www.ncbi.nlm.nih.gov/pubmed/7528809>7528809</a>";Labuda;"Evolution of secondary structure in the family of 7SL-like RNAs.";1994
140;"<a href=http://www.ncbi.nlm.nih.gov/pubmed/7529207>7529207</a>";Quentin;"Emergence of master sequences in families of retroposons derived from 7sl RNA.";1994
140;"<a href=http://www.ncbi.nlm.nih.gov/pubmed/1704372>1704372</a>";Sakamoto;"Modulation of HeLa cell growth by transfected 7SL RNA and Alu gene sequences.";1991
140;"<a href=http://www.ncbi.nlm.nih.gov/pubmed/20610725>20610725</a>";Keene;"7SL RNA is retained in HIV-1 minimal virus-like particles as an S-domain fragment.";2010
140;"<a href=http://www.ncbi.nlm.nih.gov/pubmed/18617187>18617187</a>";Zhang;"Demonstration of a multistep mechanism for assembly of the SRP x SRP receptor complex: implications for the catalytic role of SRP RNA.";2008
190;"<a href=http://www.ncbi.nlm.nih.gov/pubmed/17709395>17709395</a>";Barrandon;"The transcription-dependent dissociation of P-TEFb-HEXIM1-7SK RNA relies upon formation of hnRNP-7SK RNA complexes.";2007
140;"<a href=http://www.ncbi.nlm.nih.gov/pubmed/17881443>17881443</a>";Wang;"7SL RNA mediates virion packaging of the antiviral cytidine deaminase APOBEC3G.";2007
140;"<a href=http://www.ncbi.nlm.nih.gov/pubmed/17164479>17164479</a>";Siu;"SRP RNA provides the physiologically essential GTPase activation function in cotranslational protein targeting.";2007
140;"<a href=http://www.ncbi.nlm.nih.gov/pubmed/8389475>8389475</a>";Bernstein;"Functional substitution of the signal recognition particle 54-kDa subunit by its Escherichia coli homolog.";1993
140;"<a href=http://www.ncbi.nlm.nih.gov/pubmed/10834842>10834842</a>";Peluso;"Role of 4.5S RNA in assembly of the bacterial signal recognition particle with its receptor.";2000
140;"<a href=http://www.ncbi.nlm.nih.gov/pubmed/10684931>10684931</a>";Bhuiyan;"Assembly of archaeal signal recognition particle from recombinant components.";2000
140;"<a href=http://www.ncbi.nlm.nih.gov/pubmed/15611297>15611297</a>";Zwieb;"A nomenclature for all signal recognition particle RNAs.";2005
191;"<a href=http://www.ncbi.nlm.nih.gov/pubmed/18046331>18046331</a>";Nowacki;"RNA-mediated epigenetic programming of a genome-rearrangement pathway.";2008
191;"<a href=http://www.ncbi.nlm.nih.gov/pubmed/19372392>19372392</a>";Nowacki;"A functional role for transposases in a large eukaryotic genome.";2009
190;"<a href=http://www.ncbi.nlm.nih.gov/pubmed/20471949>20471949</a>";Sobhian;"HIV-1 Tat assembles a multifunctional transcription elongation complex and stably associates with the 7SK snRNP.";2010
190;"<a href=http://www.ncbi.nlm.nih.gov/pubmed/14627702>14627702</a>";Chen;"Phosphorylated positive transcription elongation factor b (P-TEFb) is tagged for inhibition through association with 7SK snRNA.";2004
191;"<a href=http://www.ncbi.nlm.nih.gov/pubmed/19879799>19879799</a>";Nowacki;"Epigenetic inheritance in ciliates.";2009
192;"<a href=http://www.ncbi.nlm.nih.gov/pubmed/7488100>7488100</a>";Kumimoto;"RNA polymerase II transcribes Dictyostelium untranslatable gene, dutA, specifically in the developmental phase.";1995
192;"<a href=http://www.ncbi.nlm.nih.gov/pubmed/8764472>8764472</a>";Kumimoto;"Expression of Dictyostelium early gene, dutA, is independent of cAMP pulses but dependent on protein kinase A.";1996
192;"<a href=http://www.ncbi.nlm.nih.gov/pubmed/12796308>12796308</a>";Maeda;"Changing patterns of gene expression in dictyostelium prestalk cell subtypes recognized by in situ hybridization with genes from microarray analyses.";2003
192;"<a href=http://www.ncbi.nlm.nih.gov/pubmed/8127653>8127653</a>";Yoshida;"dutA RNA functions as an untranslatable RNA in the development of Dictyostelium discoideum.";1994
192;"<a href=http://www.ncbi.nlm.nih.gov/pubmed/17435008>17435008</a>";Shimada;"Evidence that noncoding RNA dutA is a multicopy suppressor of Dictyostelium discoideum STAT protein Dd-STATa.";2007
192;"<a href=http://www.ncbi.nlm.nih.gov/pubmed/20309825>20309825</a>";Whitney;"Identifying the molecular basis of functions in the transcriptome of the social amoeba Dictyostelium discoideum.";2010
193;"<a href=http://www.ncbi.nlm.nih.gov/pubmed/1555240>1555240</a>";Hildebrandt;"Differential antisense transcription from the Dictyostelium EB4 gene locus: implications on antisense-mediated regulation of mRNA stability.";1992
194;"<a href=http://www.ncbi.nlm.nih.gov/pubmed/12607002>12607002</a>";Kramer;"Role for antisense RNA in regulating circadian clock function in Neurospora crassa.";2003
195;"<a href=http://www.ncbi.nlm.nih.gov/pubmed/7649484>7649484</a>";Duharcourt;"Epigenetic self-regulation of developmental excision of an internal eliminated sequence on Paramecium tetraurelia.";1995
195;"<a href=http://www.ncbi.nlm.nih.gov/pubmed/9819394>9819394</a>";Duharcourt;"Homology-dependent maternal inhibition of developmental excision of internal eliminated sequences in Paramecium tetraurelia.";1998
195;"<a href=http://www.ncbi.nlm.nih.gov/pubmed/18519642>18519642</a>";Lepère;"Maternal noncoding transcripts antagonize the targeting of DNA elimination by scanRNAs in Paramecium tetraurelia.";2008
195;"<a href=http://www.ncbi.nlm.nih.gov/pubmed/19103667>19103667</a>";Lepère;"Silencing-associated and meiosis-specific small RNA pathways in Paramecium tetraurelia.";2009
195;"<a href=http://www.ncbi.nlm.nih.gov/pubmed/19879799>19879799</a>";Nowacki;"Epigenetic inheritance in ciliates.";2009
190;"<a href=http://www.ncbi.nlm.nih.gov/pubmed/954090>954090</a>";Zieve;"Small RNA species of the HeLa cell: metabolism and subcellular localization.";1976
190;"<a href=http://www.ncbi.nlm.nih.gov/pubmed/9018369>9018369</a>";Krause;"Chromatin structure and function: the heretical path to an RNA transcription factor.";1996
190;"<a href=http://www.ncbi.nlm.nih.gov/pubmed/18193315>18193315</a>";Gruber;"Invertebrate 7SK snRNAs.";2008
190;"<a href=http://www.ncbi.nlm.nih.gov/pubmed/18566019>18566019</a>";Gruber;"Arthropod 7SK RNA.";2008
190;"<a href=http://www.ncbi.nlm.nih.gov/pubmed/19906723>19906723</a>";Xue;"A capping-independent function of MePCE in stabilizing 7SK snRNA and facilitating the assembly of 7SK snRNP.";2010
190;"<a href=http://www.ncbi.nlm.nih.gov/pubmed/19416841>19416841</a>";Barboric;"7SK snRNP/P-TEFb couples transcription elongation with alternative splicing and is essential for vertebrate development.";2009
190;"<a href=http://www.ncbi.nlm.nih.gov/pubmed/20562857>20562857</a>";D'Orso;"RNA-mediated displacement of an inhibitory snRNP complex activates transcription elongation.";2010
190;"<a href=http://www.ncbi.nlm.nih.gov/pubmed/20139302>20139302</a>";Raha;"Close association of RNA polymerase II and many transcription factors with Pol III genes.";2010
190;"<a href=http://www.ncbi.nlm.nih.gov/pubmed/17381310>17381310</a>";He;"Regulation of two key nuclear enzymatic activities by the 7SK small nuclear RNA.";2006
196;"<a href=http://www.ncbi.nlm.nih.gov/pubmed/19625619>19625619</a>";Li;"Role of human noncoding RNAs in the control of tumorigenesis.";2009
197;"<a href=http://www.ncbi.nlm.nih.gov/pubmed/19625619>19625619</a>";Li;"Role of human noncoding RNAs in the control of tumorigenesis.";2009
198;"<a href=http://www.ncbi.nlm.nih.gov/pubmed/19625619>19625619</a>";Li;"Role of human noncoding RNAs in the control of tumorigenesis.";2009
190;"<a href=http://www.ncbi.nlm.nih.gov/pubmed/10824089>10824089</a>";Gürsoy;"The vertebrate 7S K RNA separates hagfish (Myxine glutinosa) and lamprey (Lampetra fluviatilis).";2000
190;"<a href=http://www.ncbi.nlm.nih.gov/pubmed/19734296>19734296</a>";Marz;"Evolution of 7SK RNA and its protein partners in metazoa.";2009
190;"<a href=http://www.ncbi.nlm.nih.gov/pubmed/2443710>2443710</a>";Krüger;"Structural and functional analysis of a human 7 S K RNA gene.";1987
190;"<a href=http://www.ncbi.nlm.nih.gov/pubmed/17643375>17643375</a>";Jeronimo;"Systematic analysis of the protein interaction network for the human transcription machinery reveals the identity of the 7SK capping enzyme.";2007
93;"<a href=http://www.ncbi.nlm.nih.gov/pubmed/20149803>20149803</a>";Koshimizu;"Oxytocin stimulates expression of a noncoding RNA tumor marker in a human neuroblastoma cell line.";2010
199;"<a href=http://www.ncbi.nlm.nih.gov/pubmed/18851839>18851839</a>";Lefevre;"The LPS-induced transcriptional upregulation of the chicken lysozyme locus involves CTCF eviction and noncoding RNA transcription.";2008
201;"<a href=http://www.ncbi.nlm.nih.gov/pubmed/10814723>10814723</a>";Millar;"Disruption of two novel genes by a translocation co-segregating with schizophrenia.";2000
202;"<a href=http://www.ncbi.nlm.nih.gov/pubmed/12719555>12719555</a>";Vigneau;"Tmevpg1, a candidate gene for the control of Theiler's virus persistence, could be implicated in the regulation of gamma interferon.";2003
202;"<a href=http://www.ncbi.nlm.nih.gov/pubmed/11735227>11735227</a>";Vigneau;"Homology between a 173-kb region from mouse chromosome 10, telomeric to the Ifng locus, and human chromosome 12q15.";2001
203;"<a href=http://www.ncbi.nlm.nih.gov/pubmed/13130513>13130513</a>";Polesskaya;"Novel putative nonprotein-coding RNA gene from 11q14 displays decreased expression in brains of patients with schizophrenia.";2003
204;"<a href=http://www.ncbi.nlm.nih.gov/pubmed/12213198>12213198</a>";Vincent;"The RAY1/ST7 tumor-suppressor locus on chromosome 7q31 represents a complex multi-transcript system.";2002
206;"<a href=http://www.ncbi.nlm.nih.gov/pubmed/10731720>10731720</a>";Okutsu;"Expression and imprinting status of human PEG8/IGF2AS, a paternally expressed antisense transcript from the IGF2 locus, in Wilms' tumors.";2000
207;"<a href=http://www.ncbi.nlm.nih.gov/pubmed/9063754>9063754</a>";Wevrick;"An imprinted mouse transcript homologous to the human imprinted in Prader-Willi syndrome (IPW) gene.";1997
207;"<a href=http://www.ncbi.nlm.nih.gov/pubmed/8895514>8895514</a>";Rachmilewitz;"Characterization of the imprinted IPW gene: allelic expression in normal and tumorigenic human tissues.";1996
208;"<a href=http://www.ncbi.nlm.nih.gov/pubmed/14562104>14562104</a>";Deleault;"RNA molecules stimulate prion protein conversion.";2003
208;"<a href=http://www.ncbi.nlm.nih.gov/pubmed/18456654>18456654</a>";Gomes;"Prion protein complexed to N2a cellular RNAs through its N-terminal domain forms aggregates and is toxic to murine neuroblastoma cells.";2008
208;"<a href=http://www.ncbi.nlm.nih.gov/pubmed/12946346>12946346</a>";Adler;"Small, highly structured RNAs participate in the conversion of human recombinant PrP(Sen) to PrP(Res) in vitro.";2003
